,0,1,2,3
2501,2016-12-12 19:13:40+00:00,ArlingtonPD,The girls @ahscolts golf team delivered our Police Academy an early Christmas present. Thank you Colts!,
2502,2016-12-12 01:26:11+00:00,ArlingtonPD,A beautiful skyline of the @CityOfArlington Entertainment District from above. Hope everyone had a great weekend!,
2503,2016-12-11 19:21:52+00:00,ArlingtonPD,Looking good @ArlingtonChief,
2504,2016-12-11 14:01:04+00:00,ArlingtonPD,A good Sunday morning to you all and time for some Service with a Smith. Our East evening shift will be taking... http://fb.me/Yv919457,
2505,2016-12-11 00:07:53+00:00,ArlingtonPD,Citizens always being friendly! Thanks for the hot chocolate to warm our traffic officers up who are directing traffic at @ArlingtonHlands,
2506,2016-12-10 17:15:49+00:00,ArlingtonPD,Wow. That was fast! Thanks to the public for assisting us. John Hughes was just located safely!,
2507,2016-12-10 16:16:10+00:00,ArlingtonPD,"Temps are rebounding and you're itching to go outside, but before you do take a peek at this list. Our Top-10... http://fb.me/6ZX0pDqSR",
2508,2016-12-10 15:06:50+00:00,ArlingtonPD,"Everyone was all smiles last night at the Christmas party for the MAY program. Parents, mentors and mentees had a great time.",
2509,2016-12-10 04:48:25+00:00,ArlingtonPD,They didn't pull anyone over,
2510,2016-12-09 20:52:51+00:00,ArlingtonPD,We actually published information an hour ago on Twitter. Thanks,
2511,2016-12-09 19:46:46+00:00,ArlingtonPD,"This incident occurred last night around 11 pm in SE Arlington. 1 adult arrested, 1 juvenile arrested & 1 other juvenile released to parents",
2512,2016-12-09 19:45:34+00:00,ArlingtonPD,"Officers recover stolen vehicle & gun at 7-11 New York/Sublett after 4 people run from car. K9, Helicopter, & officers locate 3 of 4 persons",
2513,2016-12-08 20:15:15+00:00,ArlingtonPD,We received this cute Christmas card from Joe Gilstrap.... it definitely made us chuckle.... haha ,
2514,2016-12-08 17:14:43+00:00,ArlingtonPD,Surveillance video of our two suspects who stole over 20k in jewelry from an East side store.,
2515,2016-12-08 14:37:21+00:00,ArlingtonPD,"These 2 went into a jewelry store, distracted the owner, and cleaned out over 20k in jewelry. Call Det. Belauskas at 817-459-5811 with info.",
2516,2016-12-07 18:19:38+00:00,ArlingtonPD,Officers Kim Fretwell and Thomas Green stopped by the Texas Leadership Academy to drop off treats for the kids. They were quite pleased.,
2517,2016-12-07 15:21:02+00:00,ArlingtonPD,Never forgotten. #GreatestGeneration,#GreatestGeneration
2518,2016-12-06 19:04:57+00:00,ArlingtonPD,Woman lost control and drove through front door of @Walgreens at Lamar &amp; Davis. Thankfully no injuries! Everyone is okay!,
2519,2016-12-06 17:37:04+00:00,ArlingtonPD,Thank you to our Victim Services interns for all your hard work this year. We will miss them but congratulate them on their graduations!,
2520,2016-12-05 22:08:24+00:00,ArlingtonPD,Officer Gilbert visiting with @BrandonToddFOX4 and members of the media. You will not want to miss this story tonight.,
2521,2016-12-05 14:58:15+00:00,ArlingtonPD,Officer Brandon Gilbert bought 2 new cars seats for a single mom after a traffic stop with his own money. Well done Brandon! #TisTheSeason,#TisTheSeason
2522,2016-12-04 00:28:40+00:00,ArlingtonPD,"Busy day for APD... since midnight, we have responded to 31 major crashes &amp; 21 minor crashes. Roads are slick. See the attached graphic",
2523,2016-12-03 19:34:33+00:00,ArlingtonPD,Nothing beats a talk with Sgt Harrison about mentoring at the SE Arlington Library for a #SelfieSaturday.,#SelfieSaturday
2524,2016-12-01 22:46:20+00:00,ArlingtonPD,It benefits all @CityOfArlington residents not AHS,
2525,2016-12-01 20:48:28+00:00,ArlingtonPD,Monday night Team APD takes on @ahscolts in a charity hoops game at 6 p.m. Admission is just $3 or an unwrapped toy benefitting Santa Cop.,
2526,2016-12-01 14:28:49+00:00,ArlingtonPD,Media staging is on the east end of Belemeade Street from call location reference shooting incident.,
2527,2016-11-30 17:28:22+00:00,ArlingtonPD,"Look at Ofc. Marcus Camper. We knew he could climb the ladder as one of the best WR's @MeanGreenFB ,but he can also top off a Christmas tree",
2528,2016-11-30 15:21:57+00:00,ArlingtonPD,"While bouncing around town and shopping this week, keep an eye out for these faces. $1,000 from @USACrimeStop for info leading to an arrest.",
2529,2016-11-29 16:48:40+00:00,ArlingtonPD,"Packages are on the way after #CyberMonday. You don't want this guy showing up, took 2 packages recently. Call Det. Kubinsky at 817-459-6071",#CyberMonday
2530,2016-11-29 03:28:33+00:00,ArlingtonPD,We would like to recognize a recruit officer who is currently in our police academy who travelled to Missouri... http://fb.me/17ZjBVj86,
2531,2016-11-28 00:07:52+00:00,ArlingtonPD,Great story by @NBCDFW @NBCSports on Arlington PD's Coach 5-0 program that is building trust w/teens http://www.nbcdfw.com/news/sports/Inside-HS-Sports--SEG-2--112616_Dallas-Fort-Worth-403167386.html @dwatkinsNBC5,
2532,2016-11-26 22:23:28+00:00,ArlingtonPD,update please,
2533,2016-11-26 20:42:57+00:00,ArlingtonPD,Thanks. Passed along to public works.,
2534,2016-11-25 16:37:39+00:00,ArlingtonPD,Great day to come out to @ParksArlington &amp; @ArlingtonHlands to do your Black Friday shopping! Traffic is flowing excellent &amp; bargains galore,
2535,2016-11-25 11:44:01+00:00,ArlingtonPD,"Holiday shoppers, be aware of the traffic patterns around the @ParksArlington and the @ArlingtonHlands . They begin today.",
2536,2016-11-24 20:13:48+00:00,ArlingtonPD,No major traffic issues reported by @CityOfArlington Traffic Mngt. Center 4 @dallascowboys game. Everyone is getting into @ATTStadium ontime,
2537,2016-11-24 13:02:00+00:00,ArlingtonPD,We are thankful for every one of our officers and the great community we serve. Go load up on food and go @dallascowboys ! #Thanksgiving,#Thanksgiving
2538,2016-11-24 12:01:05+00:00,ArlingtonPD,Happy Thanksgiving everyone! We are thankful for each and every one of our officers. We are also thankful to... http://fb.me/1zxlA2UHW,
2539,2016-11-24 01:02:07+00:00,ArlingtonPD,All lanes open,
2540,2016-11-24 00:40:38+00:00,ArlingtonPD,"Our thoughts and prayers go out to his family, police colleagues, university family.",
2541,2016-11-23 21:11:24+00:00,ArlingtonPD,Major crash investigation east bound IH 20 at Matlock with two inside lanes closed. Car versus a motorcycle. Heavy delays in area.,
2542,2016-11-23 17:10:36+00:00,ArlingtonPD,East Police District answered the call to serve Thanksgiving meals to students and their families who just couldn’t wait to Thanksgiving Day,
2543,2016-11-23 16:08:11+00:00,ArlingtonPD,"Officer James Evan Johnson End of Watch Ceremony: November 23, 1930 http://www.arlington-tx.gov/police/in-memoriam/james-evan-johnson/",
2544,2016-11-23 14:17:59+00:00,ArlingtonPD,"Help us fatten up your wallet by $1,000 this Thanksgiving. Any information on our Top-10 that leads to an arrest, @USACrimeStop will pay.",
2545,2016-11-22 22:01:30+00:00,ArlingtonPD,"These two are not your average ordinary cleaners, they stole two vacuum machines valued at $6,500 each. Call Det. Garofano at 817-459-6092.",
2546,2016-11-21 19:30:24+00:00,ArlingtonPD,"14 Peace Officers killed in the Line of Duty in the first 20 days of November 2016, most from gunfire. #HeroesLiveForever #NeverForgotten",#HeroesLiveForever #NeverForgotten
2547,2016-11-21 02:11:01+00:00,ArlingtonPD,Major crash investigation Collins at Green Oaks. Both lanes of Collins closed between Brown Blvd. and Green Oaks.,
2548,2016-11-20 23:47:02+00:00,ArlingtonPD,"Our hearts grieve along with San Antonio Police @SATXPolice who lost a brother in blue, Detective Benjamin Marconi, who was ambushed today",
2549,2016-11-19 15:49:01+00:00,ArlingtonPD,"Our newest batch of 9-1-1 dispatchers took a break from training for a quick #SelfieSaturday. Silly group, but vital to our department.",#SelfieSaturday
2550,2016-11-18 22:24:06+00:00,ArlingtonPD,"Congrats to newly promoted officers by @ArlingtonChief. Welcome Sergeants Jones, Rosado, and Martin and Lieutenant Williams. #Leadership",#Leadership
2551,2016-11-18 18:34:14+00:00,ArlingtonPD,"#FurreverFriday, Marley and Officer Hyder out at the Arlington Animal Shelter. He can be eating a drumstick at your home for only $25.",#FurreverFriday
2552,2016-11-18 15:21:59+00:00,ArlingtonPD,We want you to be a part of Santa Cops this year. Help make Christmas morning one to remember for families across Arlington. #TeamAPD,#TeamAPD
2553,2016-11-17 02:04:08+00:00,ArlingtonPD,Yes,
2554,2016-11-16 20:41:28+00:00,ArlingtonPD,"The new edition of ""On Call"" is out and ready for you to enjoy. We updated you on each side of town and what is... http://fb.me/1JR3FRBez",
2555,2016-11-16 15:24:43+00:00,ArlingtonPD,"This group of 10 faces could get yourself 10 $100 bills. Our Top-10 Most Wanted. @USACrimeStop pays $1,000 for info that leads to an arrest.",
2556,2016-11-15 16:41:25+00:00,ArlingtonPD,"Pretty brazen burglary, this guy forces his way into a home and runs off with the TV and other items. Contact Det. Ortiz at 817-459-5824.",
2557,2016-11-15 01:35:58+00:00,ArlingtonPD,actually we help people and want to make a positive difference in the communities we serve through public safety.,
2558,2016-11-15 01:34:58+00:00,ArlingtonPD,Sure,
2559,2016-11-14 01:38:21+00:00,ArlingtonPD,Wow! Beautiful photo of moon with @SixFlagsOverTX in background!!! @CityOfArlington Photo Credit: Kevin Brown,
2560,2016-11-13 16:16:33+00:00,ArlingtonPD,Please watch your speeds. Looking for aggressive drivers on IH 30 this morning. This car was moving at 97 mph. #ArriveAlive #DriveSafe,#ArriveAlive #DriveSafe
2561,2016-11-13 04:36:19+00:00,ArlingtonPD,A boa constrictor was found on retaining wall @ToysRUs near @ParksArlington Mall. Officer Altimus rescued &amp; released it to wildlife rescue,
2562,2016-11-12 22:33:38+00:00,ArlingtonPD,Trey has been located at Bowie High School. He's being checked at this time by officers and medical. Thank you Arlington for assisting!,
2563,2016-11-12 19:43:24+00:00,ArlingtonPD,"Updated flyer of missing 9-YOA Trey Ossenkop. We have 77 citizen volunteers searching along with multiple agencies. Height change to 4'08""",
2564,2016-11-12 16:40:17+00:00,ArlingtonPD,"If you are interested in volunteering to search for Trey, meet at @ArlingtonISD Williams Elementary 4915 Red Birch Lane.This is command post",
2565,2016-11-12 14:25:57+00:00,ArlingtonPD,"Trey still has not turned up overnight so we are asking the public to Lee their eyes out for him. Update on his height 4'05""/65 lbs.",
2566,2016-11-12 13:59:48+00:00,ArlingtonPD,Trey has still not come home. We have checked those parks but re-checking is a good idea specially if he's on foot. Thanks,
2567,2016-11-12 03:20:07+00:00,ArlingtonPD,Does not qualify since there is no confirmed abduction.,
2568,2016-11-12 03:19:35+00:00,ArlingtonPD,Update on search for Trey Ossenkop - @TxDPS Air One Helicopter Asset assisting with search near Fish Creek Park.,
2569,2016-11-12 02:27:20+00:00,ArlingtonPD,Yes. Meet at Command Post at Williams Elementary.,
2570,2016-11-12 01:44:50+00:00,ArlingtonPD,Citizens on Patrol Mobile driving neighborhoods looking for Trey Ossenkop 8 YOA & last seen wearing a dark shirt & blue jeans or shorts,
2571,2016-11-12 00:48:52+00:00,ArlingtonPD,"Still active command post at Williams Elementary searching for 8-year-old Trey Ossenkop. 5'05""/70 lbs. LSW: Blue or black shirt/blue jeans",
2572,2016-11-11 23:56:59+00:00,ArlingtonPD,Special Attn: Arlington and Grand Prairie Residents: We are looking for an 8-year-old missing child by the name... http://fb.me/1vxAERDh7,
2573,2016-11-11 23:51:47+00:00,ArlingtonPD,We have an active search underway in the southeast Arlington area where 8 YOA Trey Ossenkop was last seen around noon today.,
2574,2016-11-11 23:50:35+00:00,ArlingtonPD,He was last seen wearing a blue or black shirt &blue jeans. It's possible he ran away from home but we need help in locating this 8-year-old,
2575,2016-11-11 23:48:59+00:00,ArlingtonPD,"Please assist us in looking for missing 8-year-old Trey Ossenkop last seen near Williams Elementary around noon today. 5'05""/70 lbs.",
2576,2016-11-11 22:42:54+00:00,ArlingtonPD,Arlington Police Chief Will Johnson had an opportunity to pay a special visit to APD Officer Alan Webb who has... http://fb.me/6fjW4liKT,
2577,2016-11-11 18:45:52+00:00,ArlingtonPD,"A nice grin from Buddy, our 18-year old Appaloosa from our Mounted Unit, to end the week on the right note.",
2578,2016-11-11 14:04:00+00:00,ArlingtonPD,Thank you to all of our troops and all of our veterans for your service. Happy Veterans Day! #VeteransDay,#VeteransDay
2579,2016-11-10 22:27:56+00:00,ArlingtonPD,We handed out some very special awards today. Officer Edward Johnston received the Purple Heart and Medal of... http://fb.me/86uNDfUfi,
2580,2016-11-10 15:32:22+00:00,ArlingtonPD,An armed robber has hit two east side business in the last few weeks. Take a look at him and contact Det. Constantino at 817-459-5729 w/info,
2581,2016-11-09 16:02:31+00:00,ArlingtonPD,At the Car Wash..(cue the music). These 3 car wash bandits made off with a vault of money. Contact Det. Hugh Trinh at 817-459-5805 with info,
2582,2016-11-09 15:10:06+00:00,ArlingtonPD,"One of these faces could be worth $1,000. Our Top-10 Most Wanted for the week, @USACrimeStop will pay for information leading to an arrest.",
2583,2016-11-08 16:54:34+00:00,ArlingtonPD,We proudly do our duty every day. Now let's do our civic duty and #Vote #ElectionDay,#Vote #ElectionDay
2584,2016-11-05 15:27:05+00:00,ArlingtonPD,"One of our own is in the battle of his life. Officer Alan Webb is fighting cancer, but that hasn't stopped him... http://fb.me/1ywGgp0wB",
2585,2016-11-04 19:54:51+00:00,ArlingtonPD,Proud of Deputy Chief LaTesha Watson for receiving 2016 Rising Star Award Recipient at Sixth Annual Inspired Women Luncheon Awards Ceremony,
2586,2016-11-04 19:22:38+00:00,ArlingtonPD,"There is a new criminal activity going around called ""Jugging"". What the heck is ""Jugging""? Here’s the deal,... http://fb.me/5NrMy02pE",
2587,2016-11-03 23:49:05+00:00,ArlingtonPD,Anyone can participate and take the class. Read more http://www.arlington-tx.gov/apdvolunteer/dog-walker-watch/,
2588,2016-11-02 21:35:11+00:00,ArlingtonPD,"We want these 10 faces. Our Top-10 Most Wanted for the Week. $1,000 would be nice bonus for you if you have info that leads to an arrest.",
2589,2016-11-02 16:39:10+00:00,ArlingtonPD,Say a prayer for our friends and family from the @DMPolice and @UrbandalePolice who are grieving today the terrible loss of two officers.,
2590,2016-11-01 16:58:21+00:00,ArlingtonPD,"The Amigos en Azul Fall Event is this weekend at Carl Knox Park from 3-5. There will be a DJ, bounce houses, free food and a petting zoo.",
2591,2016-10-31 13:30:06+00:00,ArlingtonPD,Halloween is here. While you're out be sure to stop by the South Station for a little Trunk or Treat from 6-8 p.m. Candy will be served!,
2592,2016-10-29 19:07:00+00:00,ArlingtonPD,"2 of the finest at APD, Sgt Harrison and Ofc Crutcher honored by Alpha Kappa Alpha and Omega Psi Phi with Media Award and Woman of the Year.",
2593,2016-10-29 15:37:32+00:00,ArlingtonPD,#SelfieSaturday and our 9-1-1 Communicators. They are just a few of the behind the scenes heroes that make the APD great.,#SelfieSaturday
2594,2016-10-28 20:43:54+00:00,ArlingtonPD,"Jail break edition of Furrever Friday, Detention Ofc. Amber Lee has the lovely Luna who needs to be bailed out. $25 at the Animal Shelter",
2595,2016-10-28 12:33:44+00:00,ArlingtonPD,Working Fatality Crash northbound SH 360 at MayField involving pedestrian. Mayfield exit temporarily closed.,
2596,2016-10-27 17:29:34+00:00,ArlingtonPD,Our Hometown Recruting Program just got a huge boost from the Arlington City Council. Great partnerships with the... http://fb.me/69PQZl48Q,
2597,2016-10-27 13:33:06+00:00,ArlingtonPD,"Trunk or Treat is back! #Halloween night come by the South Station from 6-8. Meet officers, dive into a patrol car and even get.....CANDY!",#Halloween
2598,2016-10-26 17:05:36+00:00,ArlingtonPD,"These 10 faces could give you some extra holiday cash and us the suspects. Top-10 Most Wanted, $1,000 for information leading to an arrest.",
2599,2016-10-26 13:34:27+00:00,ArlingtonPD,Mayor Williams gave the State of the City. This video shows the great work done by our town and officers. #Teamwork https://youtu.be/Q-QwF0GzI-c,#Teamwork
2600,2016-10-23 16:46:01+00:00,ArlingtonPD,Service with quite a smile. PSA Adriana Cortez was showing off her truck to this handsome fella who didn't want to get out. #TeamAPD,#TeamAPD
2601,2016-10-22 14:39:38+00:00,ArlingtonPD,It's coffee and donuts with a cop @MartinHigh . Pretty sure we know where the missing donut went. Thanks to #WarriorFootball for the snack.,#WarriorFootball
2602,2016-10-21 19:11:26+00:00,ArlingtonPD,"We will always remember and miss our K9 Mojo. Thanks to the generous donation of Tarrant County Blue, Finn and Hank will have a new partner.",
2603,2016-10-21 16:39:58+00:00,ArlingtonPD,Jillian Smith Charity Gala is tonight. You can still get your tickets now or at the door this evening. Proceeds go to the SafeLiving Fund.,
2604,2016-10-21 14:00:55+00:00,ArlingtonPD,"Take a bow everyone, we have our selfie suspects identified! Great work to spread the message by our social media audience, you're the best!",
2605,2016-10-20 17:04:56+00:00,ArlingtonPD,This pair stole cell phones from a car and went on a selfie spree. Their pics went to the victim's computer. Call Det. Frias at 817-459-6482,
2606,2016-10-19 21:40:16+00:00,ArlingtonPD,Spend the cold rainy morning with us tomorrow as we go live from the APD Training Center at 10 a.m. We will take... http://fb.me/57QouA0Y6,
2607,2016-10-19 18:17:00+00:00,ArlingtonPD,"It's that time of the week, our Top-10 Most Wanted. $1,000 for lending us a hand that leads to an arrest of these fugitives. #TeamWork",#TeamWork
2608,2016-10-18 20:40:10+00:00,ArlingtonPD,.@ArlingtonChief serving on a panel on Advancing 21st Century Policing Practices at @TheIACP on community-police relations #IACP2016,#IACP2016
2609,2016-10-18 18:16:29+00:00,ArlingtonPD,"The Jr. League of Arlington is hosting world's largest cornhole tourney, going for @GWR . Proceeds benefit abuse prevention programs. .",
2610,2016-10-17 21:50:02+00:00,ArlingtonPD,"BBQ and the Police Foundation, you love them both. Visit Spring Creek BBQ thru Oct. 20 and proceeds will be donated to APD Police Foundation",
2611,2016-10-17 15:38:28+00:00,ArlingtonPD,Touch-a-Truck this weekend let kids of all ages interact with big ole trucks. Officer Ruben Hilliard was busy handing out High-Fives.,
2612,2016-10-16 17:05:39+00:00,ArlingtonPD,Service with a smile. Corporal Lynette Hoerig and Officer Patrick Duffy ran into this little guy all decked out in his police uniform.,
2613,2016-10-16 16:37:15+00:00,ArlingtonPD,#IACP2016 @ArlingtonChief Will Johnson getting ready to host Youth Explorers at @TheIACP Conference,#IACP2016
2614,2016-10-14 18:55:25+00:00,ArlingtonPD,"A golf clap to our social media friends. We have identified all 3 of these individuals. Thanks to everyone, you're the best! #TeamAPD.",#TeamAPD
2615,2016-10-14 15:52:12+00:00,ArlingtonPD,#FurreverFriday brings you Officer Rangel with this little terrier/pit bull mix that needs a home. She's just $25 dollars at the shelter.,#FurreverFriday
2616,2016-10-14 14:03:51+00:00,ArlingtonPD,Read more about this award here. @ArlingtonChief,
2617,2016-10-13 22:36:46+00:00,ArlingtonPD,@imraansiddiqi This did not occur as it's being reported. Gross inaccuracies in this post,
2618,2016-10-13 22:36:37+00:00,ArlingtonPD,@imraansiddiqi This did not occur as it's being reported. Gross inaccuracies in this post,
2619,2016-10-13 22:36:17+00:00,ArlingtonPD,This did not occur as it's being reported. Gross inaccuracies in this post.,
2620,2016-10-13 22:34:38+00:00,ArlingtonPD,@imraansiddiqi This did not occur as it's being reported. Gross inaccuracies in this post.,
2621,2016-10-13 20:17:50+00:00,ArlingtonPD,"Anyone recognize this trio? They recently stole a key maker from a business and we need to get them. Give Det. Heisel a call, 817-459-5860.",
2622,2016-10-13 13:45:43+00:00,ArlingtonPD,"One of these 10 individuals could net you $1,000. Our Top-10 Most Wanted for the week.Take a good look and if you recognize them let us know",
2623,2016-10-12 19:23:19+00:00,ArlingtonPD,Please forward a DM to us with your contact info so we can look into this allegation.,
2624,2016-10-12 14:02:44+00:00,ArlingtonPD,"Drug take back on Sat. Oct. 22. Citizens can drop off unwanted meds at North, South, East Districts and Walgreens on the West side from 10-2",
2625,2016-10-11 20:13:20+00:00,ArlingtonPD,#TeamAPD is coming to @txwomans tomorrow afternoon. Come see Officer Crutcher at Hubbard Hall from 12-3 pm to join the @ArlingtonPD,#TeamAPD
2626,2016-10-10 15:44:52+00:00,ArlingtonPD,Do you recognize this man? He was pawning stolen items and we need to find him. Contact Det. Heisel at 817-459-5860.,
2627,2016-10-09 23:20:15+00:00,ArlingtonPD,"Our thoughts & prayers go out to @PalmSpringsPD as they mourn the loss of two heroes. End of Watch: October 8, 2016",
2628,2016-10-08 00:20:06+00:00,ArlingtonPD,Thank you @SamHoustonHS @ArlingtonISD for #BackingTheBlue Awesome!! @ArlingtonChief,#BackingTheBlue
2629,2016-10-07 19:41:06+00:00,ArlingtonPD,Thank you @MartinHigh @ArlingtonISD @MartinHigh for hosting us at your homecoming pep rally. Let's go Warriors!!! @ArlingtonChief,
2630,2016-10-07 19:22:19+00:00,ArlingtonPD,The @MartinHigh @ArlingtonISD Head Football Coach Bob Wager giving props to @CityOfArlington First Responders during #Homecoming Pep Rally,#Homecoming
2631,2016-10-07 19:19:56+00:00,ArlingtonPD,The gymnasium at @MartinHigh @ArlingtonISD was just rocked by a motivational speech given by @ArlingtonChief Will Johnson #Homecoming ,#Homecoming
2632,2016-10-07 19:06:55+00:00,ArlingtonPD, Thank you @MartinHigh @ArlingtonISD @MartinHighCheer for welcoming all @CityOfArlington First Responders to your homecoming pep rally! ,
2633,2016-10-07 18:36:25+00:00,ArlingtonPD,Read more on APD responses to perceived threatening activities dressed as a clown or posted threats on social media. http://fb.me/8PcbbNovJ,
2634,2016-10-07 12:48:53+00:00,ArlingtonPD,Evelyn & Maddox enjoying some delicious with Arlington's Finest at @DunkinDonuts #NationalCoffeeWithACopDay,#NationalCoffeeWithACopDay
2635,2016-10-07 12:46:29+00:00,ArlingtonPD,Hadley came by to see officers on #NationalCoffeeWithACopDay @DunkinDonuts -We are here till 9 am - Lt. Cook &amp; Chief Petty love ,#NationalCoffeeWithACopDay
2636,2016-10-06 18:56:35+00:00,ArlingtonPD,A big game needs a big flag. Good luck to the @Rangers today! #ALDS #NeverEverQuit,#ALDS #NeverEverQuit
2637,2016-10-06 02:48:21+00:00,ArlingtonPD,#NationalCoffeeWithACopDay is this FRIDAY &amp; we'll be at @DunkinDonuts from 7:30-9am. Join us for &amp; &amp; conversation. 4935 S. Cooper Street,#NationalCoffeeWithACopDay
2638,2016-10-05 19:08:12+00:00,ArlingtonPD,"We received over 1,000 goodie bags for all of our employees from @FielderChurch today. Thank you for making our day!!! @ArlingtonChief",
2639,2016-10-05 19:06:41+00:00,ArlingtonPD,"Thank you @FielderChurch for donating over 1,000 goodie bags to our staff! We appreciate you for being so compassionate",
2640,2016-10-05 01:54:16+00:00,ArlingtonPD,National Night Out was definitely a success tonight! Thank you @CityOfArlington for #BackTheBlue &amp; partnering with APD. @ArlingtonChief ,#BackTheBlue
2641,2016-10-05 01:39:11+00:00,ArlingtonPD,Assistant Chief Kevin Kolbye and Tarrant County Constable David Woodard enjoying National Night Out in Viridian. #APDNNO,#APDNNO
2642,2016-10-05 01:37:42+00:00,ArlingtonPD,#APDNNO @CityOfArlington @MayorJWilliams addressing block parties throughout tonight w/ @ArlingtonChief -Almost 200 parties Nat'l Night Out,#APDNNO
2643,2016-10-05 01:08:16+00:00,ArlingtonPD,Officer Varandas Washington getting his moves on at large National Night Out block party at Rosemont Apartments #APDNNO,#APDNNO
2644,2016-10-05 00:55:39+00:00,ArlingtonPD,National Night Out w/ @ArlingtonChief Will Johnson giving an interview with El Grande 107.5 getting some help translating from Ofcr. Aumedes,
2645,2016-10-05 00:47:46+00:00,ArlingtonPD,Large block party organized by Kathy Reilly for @CityOfArlington National Night Out! Great turnout! #BackTheBlue #APDNNO,#BackTheBlue #APDNNO
2646,2016-10-05 00:19:07+00:00,ArlingtonPD,Lt. Thedrick Andres & Sgt. Vince Pewitt attending National Night Out and speaking with neighbors. #APDNNO,#APDNNO
2647,2016-10-04 23:54:12+00:00,ArlingtonPD,Assistant Chief Jaime Ayala with Corporal Karen Martin visiting a party with Patti Noe & neighbors for National Night Out #APDNNO,#APDNNO
2648,2016-10-04 23:29:37+00:00,ArlingtonPD,Our @CityOfArlington @ArlingtonPD Youth Explorers are out tonight for National Night Out celebrations across the city #APDNNO,#APDNNO
2649,2016-10-04 23:27:23+00:00,ArlingtonPD,Deputy Chief Leland Strickland hanging out with kiddos on this beautiful National Night Out #APDNNO Send us your photos using this hashtag,#APDNNO
2650,2016-10-04 23:20:26+00:00,ArlingtonPD,.@ArlingtonChief Will Johnson addressing the first party of National Night Out on Shorewood. What an amazing turnout!!! #APDNNO,#APDNNO
2651,2016-10-04 23:17:40+00:00,ArlingtonPD,Our Auxiliary Mounted Patrol Unit at a National Night Out Party on Shorewood! #APDNNO,#APDNNO
2652,2016-10-04 23:13:23+00:00,ArlingtonPD,National Night Out has started in @CityOfArlington where residents come out and support community policing. @ArlingtonChief #APDNNO,#APDNNO
2653,2016-10-04 17:36:14+00:00,ArlingtonPD,"Today is the day!! We are so excited about National Night Out, and are looking for forward to seeing as many... http://fb.me/86nmvp5JP",
