,0,1,2,3
1514,2017-11-07 16:37:48+00:00,ArlingtonPD,The first inaugural Arlington Heroes Day parade is this Saturday at 1 p.m. Come celebrate Veterans Day downtown. https://arlingtonheroesparade.com/,
1515,2017-11-07 02:18:39+00:00,ArlingtonPD,Ok. Passing it along to traffic units,
1516,2017-11-06 01:57:29+00:00,ArlingtonPD,"Prayers for #SutherlandSprings along with all the First Responders, families &amp; victims on this tragic day of senseless violence.",#SutherlandSprings
1517,2017-11-04 21:33:00+00:00,ArlingtonPD,Don't forget to roll the clock back one hour tonight as Daylight Savings Time comes to an end at 2 a.m. #DaylightSavingsTime,#DaylightSavingsTime
1518,2017-11-04 01:51:51+00:00,ArlingtonPD,"Please #DriveSober as driving a vehicle impaired has serious consequences. #DrinkDriveGoToJail This driver charged w/DWI, Evading, &amp; drugs",#DriveSober #DrinkDriveGoToJail
1519,2017-11-04 01:42:50+00:00,ArlingtonPD,Man attempts to make a run for it& crashes into Lake. He then tried to swim to Fort Worth but that didn’t work out! Arrested for DWI & drugs,
1520,2017-11-03 14:07:13+00:00,ArlingtonPD,"Suspect broke into the 2000 block of E. Randol Mill Rd, stole specialized key card printing equipment. Det. Stellato w/info, 817-459-5782.",
1521,2017-11-02 19:24:55+00:00,ArlingtonPD,"It's a sticky November day, but let's make these 10 faces sweat a little more by tracking them down. Our Top-10 Most Wanted for the Week.",
1522,2017-11-02 12:53:59+00:00,ArlingtonPD,The APD Honor Guard had a chance to hand out some awards. This is a dedicated group of officers that serve our department in a unique way.,
1523,2017-11-01 03:26:52+00:00,ArlingtonPD,Yes,
1524,2017-11-01 03:14:57+00:00,ArlingtonPD,Incident on Kelly Hill Dr has been resolved. One suspect pronounced deceased at the scene. Our injured officer has been admitted to hospital,
1525,2017-11-01 02:34:42+00:00,ArlingtonPD,All evacuations were on Kelly Hill Drive.,
1526,2017-11-01 00:11:50+00:00,ArlingtonPD,It is not safe in the Kelly Hill area. We are doing evacuations in the area,
1527,2017-10-31 23:59:45+00:00,ArlingtonPD,Still active scene in immediate neighborhood 4300 Kelly Hill,
1528,2017-10-31 22:55:40+00:00,ArlingtonPD,Working dynamic scene in 4300 block of Kelly Hill. One APD Officer injured in shooting enrt to hospital.Scene is still unfolding. Avoid area,
1529,2017-10-31 20:29:17+00:00,ArlingtonPD,One cop taking a break for some lunch runs into a future cop ready to go for Halloween. #HappyHalloween,#HappyHalloween
1530,2017-10-31 17:35:25+00:00,ArlingtonPD,Great piece about the Emerald Park Neighborhood and their National Night Out participation.,
1531,2017-10-31 15:39:00+00:00,ArlingtonPD,"Rain or shine, the best Trunk or Treat in @CityOfArlington is happening tonight. Stop the South Station from 6-8 p.m. #HappyHalloween",#HappyHalloween
1532,2017-10-31 12:16:49+00:00,ArlingtonPD,"Remember if you have too many ""spirits"" tonight, to hand the keys off. It's a Halloween No-Refusal running through tomorrow at 5:30 a.m.",
1533,2017-10-28 20:55:48+00:00,ArlingtonPD,Sgt. Rhodes & Officer Davis attending Medical Center of Arlington Fall Festival. Weather is gorgeous and everyone was all smiles!,
1534,2017-10-28 19:04:16+00:00,ArlingtonPD,The cold temps didn’t keep APD Academy Class #53 away from supporting Joey Cushman 5K Race benefiting @SOTexas this morning. @ArlingtonChief,
1535,2017-10-28 18:11:04+00:00,ArlingtonPD,Deadly shooting overnight leaves two deceased. News Release attached.,
1536,2017-10-28 18:11:01+00:00,ArlingtonPD,#SelfieSaturday: Officer Allen enjoying a visit with the MAY Program and Yatzil. Sneaking in just enough to qualify for a photobomb is Alex.,#SelfieSaturday
1537,2017-10-28 16:26:07+00:00,ArlingtonPD,Great news! @CityOfArlington has confined the water issue and @ParksArlington and @ArlingtonHlands are open for business. Have a great Sat!,
1538,2017-10-28 16:09:20+00:00,ArlingtonPD,Also @jcpenney has water so restroom facilities are open.,
1539,2017-10-28 16:08:31+00:00,ArlingtonPD,Mainly affecting restaurants and child care facilities. Most business are open,
1540,2017-10-28 14:07:40+00:00,ArlingtonPD,This means no water for some and low water pressure for others. @ArlingtonHlands &amp; @ParksArlington are affected with no water at this time,
1541,2017-10-28 14:04:34+00:00,ArlingtonPD,The @CityOfArlington dealing w/emergency water break at Nathan Lowe and Matlock. Matlock is closed both directions at Sublett to Summerwood,
1542,2017-10-28 12:23:01+00:00,ArlingtonPD,Clean out that medicine cabinet and drop off those unused or expired prescription meds today. 4 locations around town between 10 a.m.- 2p.m.,
1543,2017-10-27 23:52:04+00:00,ArlingtonPD, Don’t forget your four-legged family tonight Forecast is calling for 32 degrees tonight. #PetSafety,#PetSafety
1544,2017-10-27 23:39:56+00:00,ArlingtonPD,Don’t return their call. Sounds like a scam for sure,
1545,2017-10-27 18:46:17+00:00,ArlingtonPD,Inside APD this month takes a look at the record-breaking number of National Night Out parties held across town. https://youtu.be/lv8fzmkSbz0,
1546,2017-10-27 16:29:47+00:00,ArlingtonPD,It was bone chilling this morning with that wind. But car thieves love it when you warm-up the car and head inside. Please don’t be a victim,
1547,2017-10-27 12:42:37+00:00,ArlingtonPD,"Brrr... it’s cold this morning. If you didn’t check the forecast, you might grab a jacket. Happy Friday folks! #NoTexasFlipFlops",#NoTexasFlipFlops
1548,2017-10-26 15:50:23+00:00,ArlingtonPD,"Our Commercial Vehicle Unit focused on N. Collins Street yesterday. 40 inspections, 116 violations, 11 citations & 13 trucks out of service",
1549,2017-10-26 13:36:57+00:00,ArlingtonPD,We need to track down this armed bank robber. Entered a bank in the 5900 blk of S. Cooper Street. Det. Constantino at 817-459-5729.,
1550,2017-10-25 23:07:02+00:00,ArlingtonPD,Congrats from the Lone Star State!,
1551,2017-10-25 13:19:54+00:00,ArlingtonPD,"One is real meth, one is fake meth. Both are dangerous. But both are off the streets thanks to good police work. A combined 244 grams.",
1552,2017-10-25 00:02:22+00:00,ArlingtonPD,Honored to be the recipient of 3 International Awards from @TheIACP on our partnership w/ @Walmart &amp; Corrective Education Company #IACP2017,#IACP2017
1553,2017-10-24 13:45:03+00:00,ArlingtonPD,One week away from the best Trunk or Treat in town. 6-8 p.m. Halloween Night come to the South District Service Center for candy and fun.,
1554,2017-10-23 19:56:39+00:00,ArlingtonPD,You can still report it to APD Road Rage hotline in the future if you get a plate.,
1555,2017-10-22 16:54:16+00:00,ArlingtonPD,This kitten is down to 8 lives. Detention Officer Wright-Chapman rescued this from the engine bay of a car after a woman flagged him down.,
1556,2017-10-21 20:15:18+00:00,ArlingtonPD,Gave some lessons on police interactions and had a lot of fun today at the YES Summit hosted by @utarlington .,
1557,2017-10-21 17:45:00+00:00,ArlingtonPD,#selfiesaturday : Officer Crutcher hanging out with her mentee Daysha from the MAY Program.,#selfiesaturday
1558,2017-10-21 14:46:02+00:00,ArlingtonPD,One week from today we have a drug take back event. You can dispose of old or unused prescription medicine safely at 4 different locations.,
1559,2017-10-21 12:19:32+00:00,ArlingtonPD,Kicking off @TheIACP Conference w/ @ArlingtonChief on a panel presenting Establishing Procedural Justice within L.E. Organizations #IACP2017,#IACP2017
1560,2017-10-20 14:02:20+00:00,ArlingtonPD,"It's never too early to plan for The Back the Blue Bash. The 5th annual party is set for March 2, 2018.",
1561,2017-10-19 15:05:00+00:00,ArlingtonPD,Great new program launched by the @CityOfArlington you will want to be part of.,
1562,2017-10-19 13:47:58+00:00,ArlingtonPD,"Any of these faces look familiar? If they do, your wallet could be up to $1,000 happier. Our Top-10 Most Wanted for the Week.",
1563,2017-10-18 19:27:06+00:00,ArlingtonPD,It was a great day out at the Green Oaks School visiting with some fantastic kids and teachers. The kids and officers had plenty of smiles.,
1564,2017-10-17 19:51:41+00:00,ArlingtonPD,"Trunk or Treat from 6-8 p.m. on Halloween night is 2 weeks away. Check out our police cars, meet McGruff and expect candy....lots of candy.",
1565,2017-10-17 13:49:18+00:00,ArlingtonPD,Had been missing since April. He found the individual who had the dog and worked pretty hard to return it.,
1566,2017-10-17 13:18:06+00:00,ArlingtonPD,"Ace Ventura has competition. ""Dogged"" determination by a detective got this missing pooch back reunited with its rightful owner.",
1567,2017-10-15 17:27:01+00:00,ArlingtonPD,#ServiceWithASmile: Officer Regan West working with her MAY mentee Blaize on her vision board and career goals.,#ServiceWithASmile
1568,2017-10-14 14:20:39+00:00,ArlingtonPD,Come see us at the First United Methodist Church for the the Touch a Truck event. Here till 1130 and lots of big rigs you will want to see.,
1569,2017-10-14 01:49:22+00:00,ArlingtonPD,"Great Homecoming night for @JamesBowieHS . Deputy Chief McGinty, Sgt. Glenn and Ofc. Gibson on the sideline to cheer on the Vols.",
1570,2017-10-13 16:09:52+00:00,ArlingtonPD,We are proud to partner with Cheryl’s Voice’s 1st annual Domestic Violence Awareness panel discussion tomorrow in Fort Worth.,
1571,2017-10-13 14:21:26+00:00,ArlingtonPD,These 2 stole an iPhone 8 and assaulted an employee in the 900 blk of N. Collins. Need to locate them. Det. Constantino at 817-459-5729.,
1572,2017-10-13 13:50:40+00:00,ArlingtonPD,South Patrol District at the Grand re-opening of @Walmart Neighborhood Market at Sublett &amp; Matlock with store manager Heather Edwards,
1573,2017-10-13 02:02:04+00:00,ArlingtonPD,"We continue to work solicitor/panhandler operations. Today, in South Arlington from 11 am to 3 pm, we made 4 arrests and issued 9 citations.",
1574,2017-10-12 18:26:04+00:00,ArlingtonPD,"One of these 10 faces could fetch you up to $1,000. Our Top-10 Most Wanted for the Week.",
1575,2017-10-12 12:53:08+00:00,ArlingtonPD,Officers Pierce and Orso visiting the kids at Newman Academy on Park Row Drive. Have a great Thursday!,
1576,2017-10-11 18:22:41+00:00,ArlingtonPD,More great community news to check out in the October issue of On Call. http://www.arlington-tx.gov/police/wp-content/uploads/sites/9/2017/10/On-Call-October-2017.pdf,
1577,2017-10-11 14:03:26+00:00,ArlingtonPD,"2 suspects trying to disguise themselves as ""official"" looking workers were burglars. Need to find them. Det. Trinh w/info at 817-459-5805",
1578,2017-10-10 14:03:02+00:00,ArlingtonPD,These 2 suspects went into the Guitar Center in North Arlington and stole multiple cymbals. We need to ID them. Det. Frias at 817-459-6482.,
1579,2017-10-10 04:39:22+00:00,ArlingtonPD,We extend our thoughts & prayers to @TexasTech Police Department as they grieve the loss of one of their own. #TexasTechPD #TexasStrong,#TexasTechPD #TexasStrong
1580,2017-10-10 00:48:13+00:00,ArlingtonPD,"Don’t give your stuff to bad guys... your , Take your , Hide your belongings. this on types of car burglars... @TheIACP",
1581,2017-10-09 12:30:02+00:00,ArlingtonPD,"It has been 25 years since we lost Officers Jerry J. Crocker and Terry Lynn Lewis – End of Watch: October 9, 1992. #HeroesLiveForever",#HeroesLiveForever
1582,2017-10-08 19:22:42+00:00,ArlingtonPD,Hope All is well in the Springs!,
1583,2017-10-08 19:10:00+00:00,ArlingtonPD,While eating @ChuysRestaurant this little girl colored a beautiful picture for @ArlingtonPD unbeknownst to the officer. Thank you Anabella!,
1584,2017-10-07 20:31:38+00:00,ArlingtonPD,Representing today at Tarrant County Pride Parade! Beautiful weather and sunny skies!,
1585,2017-10-06 18:01:45+00:00,ArlingtonPD,"We held a ceremony today for Terry Lewis & Jerry Crocker. Arlington Police Association placed wreaths EOW:October 9, 1992 #HeroesLiveForever",#HeroesLiveForever
1586,2017-10-06 14:31:49+00:00,ArlingtonPD,We must find these suspects. Same pair of guys suspected in @GrandPrairiePD case. They are purse snatching. Det. Trinh w/info 817-459-5805.,
1587,2017-10-06 00:31:19+00:00,ArlingtonPD,"This story went to @ArlingtonChief from Sgt. Waldron. Behind every badge, there is an untold story. We hope you enjoy it as much as we did.",
1588,2017-10-05 20:01:43+00:00,ArlingtonPD,Awesomeness. ,
1589,2017-10-05 18:28:37+00:00,ArlingtonPD,Somebody heinously vandalized one of our vehicles this morning. If you see the perpetrator please let us know....so we can thank them!,
1590,2017-10-05 14:39:09+00:00,ArlingtonPD,Need to find this suspect. He's using stolen credit cards to purchase gift cards at grocery stores. Det. Heisel w/info at 817-459-5860.,
1591,2017-10-04 20:26:54+00:00,ArlingtonPD,Nice little video recap of the #NationalNightOut. https://www.youtube.com/watch?v=g1HZ1EZfAqs,#NationalNightOut
1592,2017-10-04 02:16:20+00:00,ArlingtonPD,What do you do when celebrating #NationalNightOut in the rain? Move under shelter or into a garage! #NNOAPD17,#NationalNightOut #NNOAPD17
1593,2017-10-04 01:42:57+00:00,ArlingtonPD,"Even with the rain that moved in, neighbors still came out to support @ArlingtonPD #NationalNightOut #NNOAPD17 #BackTheBlue #StrongCommunity",#NationalNightOut #NNOAPD17 #BackTheBlue #StrongCommunity
1594,2017-10-04 00:24:10+00:00,ArlingtonPD,The kids at Julia Burgen Park have added a new dimension to #NationalNightOut . Water angels. #APDNNO17,#NationalNightOut #APDNNO17
1595,2017-10-04 00:20:42+00:00,ArlingtonPD,The Rotary at the @ArlingtonHlands celebrating #NationalNightOut in the South District! Rain clouds won’t dampen this crowd. #NNOAPD17,#NationalNightOut #NNOAPD17
1596,2017-10-04 00:18:51+00:00,ArlingtonPD,Lt. Garth gets an umbrella escort to his car after visiting a #NationalNightOut party at Providence at Prairie Oaks. #NNOAPD17,#NationalNightOut #NNOAPD17
1597,2017-10-04 00:10:11+00:00,ArlingtonPD,The rain didn't damper the Julia Burgen Park crowd. The beans are toasty and the BBQ still roaring. #NationalNightOut #NNOAPD17 #NNO2017,#NationalNightOut #NNOAPD17 #NNO2017
1598,2017-10-03 23:21:25+00:00,ArlingtonPD,"First stop for the Trolley, Veridian. Huge turnout as the parties for #NNOAPD17 have begun.",#NNOAPD17
1599,2017-10-03 21:21:37+00:00,ArlingtonPD,Getting ready for #NationalNightOut today! Final preparations underway. Sgt Rhodes representing East District.,#NationalNightOut
1600,2017-10-03 19:36:34+00:00,ArlingtonPD,#NationalNightOut ....make that afternoon out has begun. Had a great time at The Village at Johnson Creek Senior Community. #APDNNO17,#NationalNightOut #APDNNO17
1601,2017-10-03 19:19:51+00:00,ArlingtonPD,Welcome aboard!,
1602,2017-10-03 14:05:50+00:00,ArlingtonPD,"A few rain drops in the forecast, but a record number of parties is in our forecast for tonight. Rain or shine, #NationalNightOut is today!",#NationalNightOut
1603,2017-10-02 12:17:49+00:00,ArlingtonPD,#PrayForVegas Standing with @LVMPD @LasVegasFD during this horrible tragedy. Thoughts &amp; prayers are w/First Responders &amp; everyone affected.,#PrayForVegas
1604,2017-10-01 16:12:01+00:00,ArlingtonPD,October is Domestic Violence Awareness Month. Help us and all the surrounding communities work together to put an end to domestic violence.,
1605,2017-09-30 18:11:27+00:00,ArlingtonPD,Awesome #CoffeeWithCops event this morning @ArlingtonISD @martin_football Thanks @Amys3Angels for the pics!,#CoffeeWithCops
1606,2017-09-30 03:51:04+00:00,ArlingtonPD,"“Hello sir, can you step down and provide me your license and insurance please?” @SummitRacing",
1607,2017-09-30 02:47:30+00:00,ArlingtonPD,We are searching for the source,
1608,2017-09-30 02:34:46+00:00,ArlingtonPD,We have officers responding in the are trying to track these down. Unsure as of now.,
1609,2017-09-30 00:11:54+00:00,ArlingtonPD,Unauthorized use of motor vehicle,
1610,2017-09-29 17:42:09+00:00,ArlingtonPD,Let's close down the week by putting a few of these faces behind bars. Our Top-10 Most Wanted for the Week.,
1611,2017-09-29 15:14:04+00:00,ArlingtonPD,School Resource Officer Richard Morrison working @ArlingtonISD Young Jr. High and enjoying #NationalCoffeeDay Have a great Friday!,#NationalCoffeeDay
1612,2017-09-28 22:24:02+00:00,ArlingtonPD,Yes,
1613,2017-09-28 20:51:35+00:00,ArlingtonPD,Got expired or old prescription medicine? In one month you can safely dispose of all your unwanted medicine safely around town.,
1614,2017-09-28 14:20:53+00:00,ArlingtonPD,Looking for a purse snatcher in the 1900 blk of E. Arbrook. Left in a gray or brown Chrysler 300. Det. Pue w/info at 817-459-5808.,
1615,2017-09-27 14:18:31+00:00,ArlingtonPD,What's cooler than a police themed birthday party? Having the real deal show up. This 4-year old won't soon forget Ofc. Grimmett and Melton.,
1616,2017-09-27 02:22:09+00:00,ArlingtonPD,Yes. Call 817-459-5726 tomorrow and speak to Sgt. Pewitt,
1617,2017-09-27 01:35:28+00:00,ArlingtonPD,Large turnout tonight for Crime Watch group in South District. National Night Out is right around the corner! #CommunityPolicing,#CommunityPolicing
1618,2017-09-26 13:35:41+00:00,ArlingtonPD,"Need to ID this burglary suspect. Broke into a home in the 2000 blk of Lennox Ln, couldn't hide his face though. Det. Blanco, 817-459-6647.",
1619,2017-09-25 01:04:15+00:00,ArlingtonPD,Glad that your officers will be okay and suspect is in custody! Standing with @fortworthpd #BackTheBlue https://twitter.com/fortworthpd/status/912069405441445889,#BackTheBlue
1620,2017-09-22 17:20:09+00:00,ArlingtonPD,"3 great athletes...now 3 great officers. DC McGinty, Ofc's M. Camper and T. Green all played for the 87' @MeanGreenFB team to be honored Sat",
1621,2017-09-22 14:38:00+00:00,ArlingtonPD,A full wallet on the first day of Fall can be yours if you help us find these 10 fugitives. Our Top-10 Most Wanted for the Week.,
1622,2017-09-21 17:04:46+00:00,ArlingtonPD,Had a great time with the kids at Ashworth Elementary. They put out these pinwheels as part of International Pinwheel for #PeaceDay .,#PeaceDay
1623,2017-09-21 14:45:21+00:00,ArlingtonPD,We arrested Deontay Hampton for the shooting death of Leonard Byrd last night. He remains in the Arlington Jail on one count of murder.,
1624,2017-09-21 13:16:43+00:00,ArlingtonPD,"Don’t become a victim of a property crime. A lot of vehicle burglaries in Arlington result from unlocked cars. , Take , Hide property",
1625,2017-09-20 19:53:38+00:00,ArlingtonPD,"Summer won't let go, but the 1st graders at Summit Prep had the lemonade flowing today for officers. Thanks to the kids for a great time.",
1626,2017-09-20 18:29:23+00:00,ArlingtonPD,We had a great time visiting with 2nd graders @CoreyFADL @ArlingtonISD today and sharing what it's like to be part of Arlington's Finest!,
1627,2017-09-20 17:05:25+00:00,ArlingtonPD,"Yes, flipping the handles in parking lots or driveways.",
1628,2017-09-20 16:55:18+00:00,ArlingtonPD,"A new game in town called ""car hopping"". Thieves are targeting unlocked cars by flipping the handle. Lock your car and take your valuables.",
1629,2017-09-19 18:18:52+00:00,ArlingtonPD,Ofc. Gibson is at the @UTSACareer Fair from 1:30-4:30 today! We want to hire Roadrunners. #UTSA For info click here http://www.arlington-tx.gov/police/recruiting/,#UTSA
1630,2017-09-19 13:32:54+00:00,ArlingtonPD,"2 weeks from today it's National Night Out. Still time to register your party, but hurry so you don't miss out. http://www.arlington-tx.gov/police/crime-prevention-initiatives/national-night-out/",
1631,2017-09-17 18:10:01+00:00,ArlingtonPD,#ServiceWithASmile : Corporal Guadalupe Silva and Melissa Jones of the East District heading out for a perfect Sunday afternoon.,#ServiceWithASmile
1632,2017-09-17 14:58:14+00:00,ArlingtonPD,Find my iPhone.,
1633,2017-09-16 22:13:03+00:00,ArlingtonPD,"A stolen iPhone from 14 YOA teen led officers to a residence after using Find My App... Made 2 arrests, recovered guns &amp; drugs! Great job!",
1634,2017-09-16 22:04:22+00:00,ArlingtonPD,APD Officers Wilson&Ramirez riding w/their @houstonpolice partners before they come home tomorrow after 2 weeks. #TexasStrong #HoustonStrong,#TexasStrong #HoustonStrong
1635,2017-09-16 04:38:50+00:00,ArlingtonPD,Working major crash where possible impaired driver lost control westbound IH 20 to northbound SH 360. No major injuries. Designate a driver,
1636,2017-09-15 19:15:40+00:00,ArlingtonPD,"A composite sketch of a person of interest related to the murder that occurred on Friday, Sept 1. Det. Griesbach w/info at 817-459-5325.",
1637,2017-09-15 18:07:37+00:00,ArlingtonPD,Congrats @fortworthpd Officer Ariana Ross-Moses who graduated today.She is the daughter of @ArlingtonPD Lt. Mike Moses. #FamilyServiceInBlue,#FamilyServiceInBlue
1638,2017-09-15 16:12:33+00:00,ArlingtonPD,"2 snatch and run thieves we need to ID. These repeat offenders last hit a store in the 1500 blk of N. Collins. Det. Rodriguez, 817-459-5650",
1639,2017-09-14 16:11:38+00:00,ArlingtonPD,"A $1,000 would be a nice gift on this #NTxGivingDay . Help give us one of these 10 fugitives, our Top-10 Most Wanted for the Week.",#NTxGivingDay
1640,2017-09-14 12:05:36+00:00,ArlingtonPD,The big day is here. It's #NTxGivingDay . You can make a generous donation to help our Police Foundation. https://northtexasgivingday.org/npo/arlington-police-foundation,#NTxGivingDay
1641,2017-09-14 00:46:29+00:00,ArlingtonPD,Thanks for sharing @NBCDFW Arlington Officer Reflects on His Experiences Helping Harvey Victims. @ArlingtonChief,
1642,2017-09-13 20:09:49+00:00,ArlingtonPD,Last year a record-setting 37 million dollars was donated on #NTXGivingDay . We can top that tomorrow. https://northtexasgivingday.org/npo/arlington-police-foundation,#NTXGivingDay
1643,2017-09-13 18:53:57+00:00,ArlingtonPD,APD Deployment Team #2 and #3 preparing to direct traffic for @houstonpolice Sgt. Steve Perez's funeral.,
1644,2017-09-13 14:29:40+00:00,ArlingtonPD,NNO is right around the corner. Lt. Stevens picked out 3 lucky winners who won pizza and gift cards for their party. http://www.arlington-tx.gov/police/crime-prevention-initiatives/national-night-out/,
1645,2017-09-13 12:29:23+00:00,ArlingtonPD,Deployment Team #3 under leadership of Lt. Brian Johnson getting cars ready to attend @houstonpolice Sgt. Steve Perez #HeroesLiveForever,#HeroesLiveForever
1646,2017-09-13 12:26:34+00:00,ArlingtonPD,Sgt. Victor Hadash has patrolled with each of these @houstonpolice officers over past 2 weeks. Friendships &amp; teamwork. #TexasStrong,#TexasStrong
1647,2017-09-12 13:03:14+00:00,ArlingtonPD,More pics coming in from two deployment teams in Houston. #ServiceBeforeSelf #HonorAboveAll #TexasStrong,#ServiceBeforeSelf #HonorAboveAll #TexasStrong
1648,2017-09-12 13:00:29+00:00,ArlingtonPD,Here's a few pics from Team #2 &3 while deployed in Houston this week. They are assisting @houstonpolice with calls for service #TexasStrong,#TexasStrong
1649,2017-09-12 00:41:55+00:00,ArlingtonPD,Beautiful night giving honor to 9/11 victims @Rangers game. APD assisting with Old Glory &amp; Honor Guard on the field. #NeverForget,#NeverForget
1650,2017-09-11 23:36:10+00:00,ArlingtonPD,It's real as it gets. ,
1651,2017-09-11 13:20:08+00:00,ArlingtonPD,We will never forget those who lost their lives on 9/11. #NeverForget #USA,#NeverForget #USA
1652,2017-09-10 21:37:00+00:00,ArlingtonPD,A big game needs a big flag. First Responders getting Old Glory loose before the @dallascowboys game tonight.,
1653,2017-09-10 20:27:32+00:00,ArlingtonPD,Great day at #CowboyCopsRodeo benefitting @SOTexas with @GrandPrairiePD - Can you name these Cowboy Cops? ,#CowboyCopsRodeo
1654,2017-09-10 20:05:14+00:00,ArlingtonPD,"#NTXGivingDay is almost here. Sept. 14 is this week, but you can make a donation now and help spread the word. https://northtexasgivingday.org",#NTXGivingDay
1655,2017-09-10 18:08:24+00:00,ArlingtonPD,Gearing up for #CowboysCopsRodeo. @ArlingtonChief Johnson &amp; @GrandPrairiePD @ChiefDye sporting the West TX look ,#CowboysCopsRodeo
1656,2017-09-09 23:58:37+00:00,ArlingtonPD,"Under the leadership of Lt. Paul Rodriguez, APD Team #2 hitting the streets in Harris County with @houstonpolice #TexasStrong",#TexasStrong
1657,2017-09-09 21:12:04+00:00,ArlingtonPD,Wishing you a safe shift from Texas.,
1658,2017-09-09 17:38:05+00:00,ArlingtonPD,"We are gearing up for more Police Academy classes soon. Come check out opportunities, compensation, benefits & more! http://www.arlington-tx.gov/police/recruiting/",
1659,2017-09-09 15:52:59+00:00,ArlingtonPD,Our first deployment team has returned home today after 2 weeks in Houston area. This pic is Team #3 headed to work with @houstonpolice,
1660,2017-09-09 15:46:00+00:00,ArlingtonPD,Sergeants McDonnell and Pewitt hung out @995thewolfdfw this week promoting National Night Out. Register now. http://www.arlington-tx.gov/police/crime-prevention-initiatives/national-night-out/,
1661,2017-09-08 18:46:36+00:00,ArlingtonPD,It's always a great time when @ArlingtonChief Johnson awards his challenge coin to deserving officers &amp;detention officers 4 outstanding work,
1662,2017-09-08 16:06:13+00:00,ArlingtonPD,"The ""B"" team is ready to roll at @SalArmyTX Most Amazing Race tomorrow. Officers Sanders and Schwarzbach are representing APD. Good luck!",
1663,2017-09-08 14:30:28+00:00,ArlingtonPD,What a great morning out at @1995knights . First Responder breakfast put on by the kids. Loved the donuts and the fellowship with the kids.,
1664,2017-09-07 21:30:09+00:00,ArlingtonPD,Special thanks to USMS North Texas Violent Crime Task Force!,
1665,2017-09-07 13:03:00+00:00,ArlingtonPD,#TBT: Ofc. Wagoner making sure these kids have full pumpkins. 21 years later Sgt. Derrick Wagoner is still going strong with us at the APD.,#TBT
1666,2017-09-06 18:41:00+00:00,ArlingtonPD,Sgt. Cameron Huggins passing out badge stickers & assisting with shoe distribution for people who lost everything in Houston #TexasStrong,#TexasStrong
