,0,1,2,3
0,2020-02-09 22:21:28+00:00,ArlingtonPD,"A new era begins... Good luck to #ArlingtonTX’s newest pro sports franchise, the @XFLRenegades!!!",#ArlingtonTX
1,2020-02-09 18:02:26+00:00,ArlingtonPD,"We’re you thinking football season was over? Think again. Our own @XFLRenegades will host @XFLBattleHawks at the newest football stadium in town!Globe Life Park today at 4 pm, rain or shine. #Arlingtontx – at Globe Life Park in Arlington",#Arlingtontx
2,2020-02-08 21:10:14+00:00,ArlingtonPD,UPDATE: Great news everyone!! Our friends at #ArlingtonTX Animal Services just let us know that our #FureverFriday pup Chloe was adopted today!! Here's a picture of her with her new family!! #AmericanDreamCity,#ArlingtonTX #FureverFriday #AmericanDreamCity
3,2020-02-07 23:16:38+00:00,ArlingtonPD,"Happy #FureverFriday y'all!! This week, Investigator Heather Gibson from our Personnel &amp; Recruiting unit, got to pose with Chloe, a BEAUTIFUL 3-year-old Siberian Husky mix. If you'd like to give Chloe a furever home, you can visit her at the #ArlingtonTX Animal Shelter!!",#FureverFriday #ArlingtonTX
4,2020-02-07 15:18:42+00:00,ArlingtonPD,"As the sun rises over the Arlington Police Department parking lot, we hope you have a great day! (and maybe that it warms up just a little bit)",
5,2020-02-07 11:50:30+00:00,ArlingtonPD,"UPDATE: Mr. Starks, our Silver Alert Missing Person, was found at a local hospital and is doing well. Thank you everyone for your concern and for sharing the original post!",
6,2020-02-06 23:59:49+00:00,ArlingtonPD,Homicide Investigation We responded to an injured person at 900 Benge Dr.-4:36 p.m. We located a 16-year old male teen with an apparent gunshot wound who was later pronounced deceased at hospital. Active investigation. Anyone w/info pls call 9-1-1. Working with @ArlingtonISD,
7,2020-02-06 23:55:26+00:00,ArlingtonPD,"Ever wonder why we call our public safety center ""Ott Cribbs"" In this #ThrowbackThursday we explain why. Arthur B. ""Ott"" Cribbs started his career with the APD in 1925, was promoted to Chief in 1934 and served in that position for 37 years! https://www.arlingtontx.gov/residents/about_arlington/history_of_arlington/what_s_in_the_name_/ott_cribbs_public_safety_center",#ThrowbackThursday
8,2020-02-06 15:15:44+00:00,ArlingtonPD,"Here is the newest edition of our top ten most wanted fugitives. If you know their location, PLEASE call Crime Stoppers at 817-469-8477. Crime Stoppers of Tarrant County will pay up to $1,000 for information leading to an arrest. #TopTen #MostWanted @469",#TopTen #MostWanted
9,2020-02-05 17:52:28+00:00,ArlingtonPD,"In honor of #BlackHistoryMonth, we would like to take the time to recognize those who helped forge the path for many of our officers today. This is Teresa Ivy, APD's first African American female police officer. Your service to this community and department won't be forgotten!",#BlackHistoryMonth #BlackHistoryMonth
10,2020-02-04 13:54:23+00:00,ArlingtonPD,Inside APD highlights school partnerships with @ArlingtonISD @utarlington on our Hometown Recruiting. https://youtu.be/wtG8hTfOzP4,
11,2020-02-04 00:09:52+00:00,ArlingtonPD,Not a bad sight to end the work day! #ArlingtonTX,#ArlingtonTX
12,2020-02-02 05:56:21+00:00,ArlingtonPD,She has been found safe near IH 30 and Six Flags. Thank you for your help!,
13,2020-02-02 04:16:08+00:00,ArlingtonPD,"We need your help in locating 66-year old Toni Walker, 5’3 140lbs & wears hair in a ponytail. She was last seen wearing a gray/blue jacket, black pants, & black sneakers. She has stars tattooed on her neck. Last seen on foot around ATT Stadium at 1030 am & suffers from dementia.",
14,2020-02-01 01:56:43+00:00,ArlingtonPD,UPDATE: Wow!! You guys don’t waste any time! Our friends at Arlington Animal Services have informed us that Xena has been adopted!! Happy Friday indeed!! #ArlingtonTX,#ArlingtonTX
15,2020-01-31 15:14:38+00:00,ArlingtonPD,"Who's ready for another adorable edition of #FureverFriday?! This week, we have Investigator Jennifer Archer posing with Xena, a 2-year-old Doberman Pinscher mix. If you're interested in giving Xena a ""furever"" home, you can meet her at the #ArlingtonTX Animal Shelter!!",#FureverFriday #ArlingtonTX
16,2020-01-31 04:00:19+00:00,ArlingtonPD,Tonight’s crash scene in the 4300 block of Matlock resulted in two fatalities and three injured. The crash remains under investigation and the roadway will remain closed for a couple of hours while detectives finish up. Northbound Matlock traffic is being diverted to Center St.,
17,2020-01-31 02:10:59+00:00,ArlingtonPD,Northbound Matlock at Stevens closed due to a major crash. Traffic is being diverted eastbound on Stevens to Center. Delays in area.,
18,2020-01-29 23:19:45+00:00,ArlingtonPD,On this #WhosThatWednesday we wanted to draw your attention to our Cold Case page on our website. Call Crime Stoppers of Tarrant County at 817-469-8477 to leave a tip and remain anonymous. Crime Stoppers pays for tips. @469tips https://www.arlingtontx.gov/city_hall/departments/police/community/crime_prevention/cash_for_crooks/cold_cases,#WhosThatWednesday
19,2020-01-29 01:26:26+00:00,ArlingtonPD,"Let’s talk about blocking intersections, y’all. It’s not cool. And it’s illegal to prevent cross-traffic from getting through. Please make sure you can get all the way through an intersection before you enter one. If not, wait at the light until you can. #TrafficTipTuesday",#TrafficTipTuesday
20,2020-01-27 16:55:36+00:00,ArlingtonPD,"UPDATE: Well here's a nice little ray of sunshine to break through all the fog this morning!! Over the weekend, our #FureverFriday pup Brooks was adopted!! Here he is with his new family!! #ArlingtonTX #AmericanDreamCity",#FureverFriday #ArlingtonTX #AmericanDreamCity
21,2020-01-26 03:17:24+00:00,ArlingtonPD,"Congrats to our Explorers who placed 1st OVERALL, 3rd in Accident Investigation, 2nd in Misdemeanor Traffic Stops, 2nd in Suspicious Devices, and 2nd in Investigations at a competition today. Clay Gleason also placed third in Bicycle Challenge. https://www.arlingtontx.gov/city_hall/departments/police/community/community_programs/youth_initiatives",
22,2020-01-25 20:02:45+00:00,ArlingtonPD,"Arrest made in homicide. On Friday, we were notified of an arrest made in the murder of Cedric Dawkins which occurred on January 1, 2020. Antonio Garcia, 27-years of age, was arrested in Los Angeles, California by the @USMarshalsHQ and @LASDHQ Working on extradition.",
23,2020-01-25 14:44:26+00:00,ArlingtonPD,Working a major crash with a car that lost control and drove into a local restaurant in the 6000 block of S. Cooper this morning. The driver is unharmed and no one was inside the business. Investigators are looking into it as a possible medical issue and no charges are expected.,
24,2020-01-25 14:36:33+00:00,ArlingtonPD,Looks good.,
25,2020-01-24 19:10:55+00:00,ArlingtonPD,"Time for another edition of #FureverFriday!! This week, Det. Thomas Stellato is teaming up with Brooks, a 4-year-old German Shepherd mix. If you'd like to give Brooks a ""furever"" home, you can meet him at the #ArlingtonTX Animal Shelter, located at 1000 SE Green Oaks Blvd.",#FureverFriday #ArlingtonTX
26,2020-01-24 03:28:41+00:00,ArlingtonPD,Fatality Crash this evening at 6:02 pm on S. Bowen near Park Row Drive involving a motorcycle and SUV. Operator of motorcycle was ejected and pronounced deceased at scene. Crash remains under investigation.,
27,2020-01-23 23:36:13+00:00,ArlingtonPD,"Thought you might enjoy some photos of our new satellite Harold K. Elliott Museum at our Main Station Patrol Briefing room. Yes, we used to wear tan uniforms! #ArlingtonTX #ThrowbackThursday – at Ott Cribbs Public Safety Center",#ArlingtonTX #ThrowbackThursday
28,2020-01-23 01:38:14+00:00,ArlingtonPD,"It’s time for another edition of “Who’s That? Wednesday” — and this week, we need your help to ID this lottery looter. He’s stolen lottery tickets from multiple convenience stores in #ArlingtonTX. If you recognize him, please call Det. Stellato at (817) 459-5728.",#ArlingtonTX
29,2020-01-23 00:48:26+00:00,ArlingtonPD,UPDATE: the wreck has been cleared and Arkansas Ln has reopened.,
30,2020-01-22 23:05:48+00:00,ArlingtonPD,Working a crash involving two cars and an @ArlingtonISD school bus at 4400 W. Arkansas and 2200 Woodside. Westbound Arkansas is closed at Woodside and eastbound Arkansas is closed at Little Rd. One adult and one teen transported as a precaution. No serious injuries reported.,
31,2020-01-22 14:56:52+00:00,ArlingtonPD,"UPDATE: Need a boost on this wet, gloomy Wednesday? This oughta help! Hazel, our most recent #FureverFriday pup, has been adopted!! Here she is with her new family!! #ArlingtonTX #AmericanDreamCity",#FureverFriday #ArlingtonTX #AmericanDreamCity
32,2020-01-22 02:15:27+00:00,ArlingtonPD,"When two APD sergeants noticed that several kids at Lynn Hale Elementary were coming to school with old, worn down shoes, they mobilized the community — which delivered 200+ pairs of new shoes for the whole school! #ArlingtonTX #AmericanDreamCity",#ArlingtonTX #AmericanDreamCity
33,2020-01-22 00:14:23+00:00,ArlingtonPD,"Its our #TopTen #MostWanted. Crime Stoppers will pay up to $1,000 for information leading to the arrest of these fugitives. If you have any information on their location, PLEASE contact Safe City Commission Crime Stoppers at 817-469-8477. You can remain anonymous. @469tips",#TopTen #MostWanted
34,2020-01-21 19:44:46+00:00,ArlingtonPD,"With rain in the forecast, we wanted to “sprinkle” a few reminders on your feed about driving in wet conditions: -Make sure your wipers & tires are -If you hydroplane, steer in the direction you want to go -Slow down, leave room, don’t use cruise control #TrafficTipTuesday",#TrafficTipTuesday
35,2020-01-19 20:58:52+00:00,ArlingtonPD,"The @USMarshalsHQ in Shreveport arrested 31-year old Leah Franklin for Murder resulting from the death of Antonio Merle on January 11, 2020. Medical Examiner ruled the case a homicide. The suspect remains in the Shreveport Jail pending extradition back to Tarrant County.",
36,2020-01-18 19:39:53+00:00,ArlingtonPD,Our East Patrol District was present for the Lunar Festival at Ben Thanh Plaza in East Arlington today. It was a wonderful celebration!,
37,2020-01-17 22:38:26+00:00,ArlingtonPD,"Let's start the weekend off strong with another edition of #FureverFriday!! This week, Officer Stacie Brown had the pleasure of posing w/ Hazel, a 2-year-old terrier / pit mix. If you'd like to give Hazel a ""furever"" home, you can visit her at the #ArlingtonTX Animal Shelter.",#FureverFriday #ArlingtonTX
38,2020-01-17 21:01:23+00:00,ArlingtonPD,"So they got with the Arlington Police Foundation — and together, they were able to get 200 pairs of brand new shoes for every student at the school. This afternoon, we got to surprise the kids with their new shoes — and other shwag that was donated! #ArlingtonTX",#ArlingtonTX
39,2020-01-17 20:56:29+00:00,ArlingtonPD,"There’s no greater gift we can give the students of this community than our love and support. Today, the kids at Lynn Hale Elementary experienced that firsthand. Our officers who work at the school noticed that a lot of the students were coming to school with worn down shoes...",
40,2020-01-17 16:12:23+00:00,ArlingtonPD,"UPDATE: So it turns out Officer Herlihy was so smitten with this kitten she rescued, she went back to the Arlington Animal Shelter this week and officially adopted him!! Here she is with her new pal Samson #ArlingtonTX #AmericanDreamCity",#ArlingtonTX #AmericanDreamCity
41,2020-01-16 21:12:56+00:00,ArlingtonPD,Fun fact alert!! Did you know that Arlington PD officers have been riding motorcycles for more than a century?! The department bought its first motorcycle back in 1912. Here’s an old photo we uncovered of APD’s motorcycle unit back in 1922. #TBT #ArlingtonTX,#TBT #ArlingtonTX
42,2020-01-16 16:19:49+00:00,ArlingtonPD,"These two recently went to a car wash in the 2200 block of Pioneer Pkwy - but they weren't interested in cleaning out their pickup. Instead, they tried to clean out a coin machine at the business. If you recognize them, please call Det. Trinh at (817) 459-5805. #ArlingtonTX",#ArlingtonTX
43,2020-01-15 23:52:34+00:00,ArlingtonPD,"We are looking for 3 subjects who were taking items from a store located in the 900 Blk. E. Randol Mill Rd. earlier this month. They loaded a cart with stolen items and displayed a weapon. If you recognize these suspects, call @469tips (817) 469-8477 #WhosThatWednesday ",#WhosThatWednesday
44,2020-01-14 20:50:19+00:00,ArlingtonPD,"In case you hadn't noticed, #ArlingtonTX has a few road construction projects in progress. Ergo, we'd like to remind drivers to SLOW DOWN in work zones and obey the posted speed limits. Remember, traffic fines double when workers are present. #TrafficTipTuesday",#ArlingtonTX #TrafficTipTuesday
45,2020-01-13 22:09:34+00:00,ArlingtonPD,Thanks to the U.S. National Football Team @USNFT for teaming up with us today to clean up a little bit of Arlington in some local neighborhoods! Your service to our community is much appreciated! #ArlingtonKindness #GoodWorks #NFLHuddleFor100 #USAFootballHuddleFor100,#ArlingtonKindness #GoodWorks #NFLHuddleFor100 #USAFootballHuddleFor100
46,2020-01-13 18:06:39+00:00,ArlingtonPD,"10 years ago, on Jan. 13, 2010, we were shocked by the sudden loss of Ofc. Craig Story. Craig‘s attention to duty was deep and his smile was contagious. We will never forget Craig’s legacy and sacrifice. Today we remembered him with an End of Watch Ceremony. #NeverForgotten",#NeverForgotten
47,2020-01-13 02:44:41+00:00,ArlingtonPD,"It’s about dang time!! Without @JimmyJohnson, there is no “America’s Team” — or “How bout them Cowboys?!” for that matter. Congrats Coach!! Well deserved!! #JimmyJohnson #DallasCowboys #PFHOF20 #ArlingtonTX",#JimmyJohnson #DallasCowboys #PFHOF20 #ArlingtonTX
48,2020-01-13 00:00:30+00:00,ArlingtonPD,Beautiful colors in the sunset this evening to cap the cold weekend off.,
49,2020-01-12 20:34:23+00:00,ArlingtonPD,"UPDATE: Some happy news to pass along on this sunny Sunday!! Cowboy, who was our #FureverFriday pup a couple weeks ago, has finally been adopted!! Here he is with his new family!! #ArlingtonTX #AmericanDreamCity",#FureverFriday #ArlingtonTX #AmericanDreamCity
50,2020-01-12 18:35:19+00:00,ArlingtonPD,Happy Sunday folks. The sun is out and temps are on the rise. Enjoy your day from Arlington’s Finest.,
51,2020-01-12 00:31:31+00:00,ArlingtonPD,"HOMICIDE INVESTIGATION On Saturday, January 11, 2020 at 2:44 a.m., officers responded to a reported stabbing in the 5700 block of Prescott Drive. A male subject was transported to a hospital where he was later pronounced deceased. Detectives investigating. 817-469-TIPS",
52,2020-01-11 17:54:08+00:00,ArlingtonPD,"Not your typical prisoner... Officer Herlihy was on patrol when she saw a scared, wet & cold cat in a storm drain. She took him under her wing, dried him & provided some of her lunch to him. She then got him to our shelter safe & sound. He will be available to adopt soon!",
53,2020-01-11 17:42:39+00:00,ArlingtonPD,"UPDATE: Great news everybody — and we’re not just talking about the snow! Ryker, our #FureverFriday pup, has been adopted!! Here he is with his new family!! #ArlingtonTX #AmericanDreamCity",#FureverFriday #ArlingtonTX #AmericanDreamCity
54,2020-01-11 15:40:41+00:00,ArlingtonPD, Snow flurries falling across @CityOfArlington Don’t blink or you’ll miss them. Gotta love Texas weather with the extreme temp changes over past 24-hours. #dfwwx,#dfwwx
55,2020-01-11 01:52:15+00:00,ArlingtonPD,Yes of course! Ran out of characters but our local radio do a tremendous job in keeping residents informed! @KRLD @WBAP247NEWS @570KLIF in addition to other stations,
56,2020-01-11 01:47:49+00:00,ArlingtonPD,We wanted give a huge shout out to our local @NWSFortWorth &amp; media stations for keeping us informed @Fox4Weather @NBCDFWWeather @wfaaweather @CBSDFW @cbs11doug @RickMitchellWX @GrantJNBC5 @JesseWFAA @BrianJamesNBC5 @KyleWeather @WxManDanHenry &amp; many others Thank you!!! #dfwwx,#dfwwx
57,2020-01-11 00:19:50+00:00,ArlingtonPD,Please continue to monitor local weather alerts for @CityOfArlington @ArlingtonTxFire #dfwwx,#dfwwx
58,2020-01-11 00:12:46+00:00,ArlingtonPD,Tornado Warning issued for @CityOfArlington #dfwwx @ArlingtonTxFire,#dfwwx
59,2020-01-11 00:10:06+00:00,ArlingtonPD,Please be weather aware and follow local media and the @NWSFortWorth The Parks Mall has sounded their weather alerts and requested shoppers shelter in place until storm has passed. #DFWWX,#DFWWX
60,2020-01-10 18:52:18+00:00,ArlingtonPD,Tractor trailer with flatbed was exiting Six Flags Drive from westbound IH 30 and overturned. Minor injuries and no other vehicles involved. #DFWTraffic,#DFWTraffic
61,2020-01-10 17:46:10+00:00,ArlingtonPD,"Weather got you down? #FureverFriday is here to save the day! Today, we have Crime Prevention Officer Marisa Sandham posing with Ryker, a 1 1/2-year-old retriever mix. Want to give him a ""furever"" home? You can visit Ryker at the Arlington Animal Shelter! #ArlingtonTX",#FureverFriday #ArlingtonTX
62,2020-01-09 22:58:26+00:00,ArlingtonPD,Aidan's dad is a civilian employee here at APD. Suffice it say that he and his wife have raised a very thoughtful and caring young man!! Way to go Aidan!! #ArlingtonTX #AmericanDreamCity #AustraliaBushFires,#ArlingtonTX #AmericanDreamCity #AustraliaBushFires
63,2020-01-09 17:29:14+00:00,ArlingtonPD,The Advocates for Special People in Arlington stopped by today and dropped off goodie bags for West Patrol Officers to thank them for their service. We are happy to serve all members of our community. Thank you for your appreciation! #LawEnforcementAppreciationDay,#LawEnforcementAppreciationDay
64,2020-01-07 18:20:27+00:00,ArlingtonPD,It’s officially official y’all. Welcome to North Texas Coach McCarthy! We hope you do A LOT of winning here in #ArlingtonTX! #DallasCowboys,#ArlingtonTX #DallasCowboys
65,2020-01-07 14:15:21+00:00,ArlingtonPD,"Its Tuesday, Here is a traffic tip: As winter break comes to a close, remember AISD school starts up again this morning. Watch out for the kids in and around school zones and expect some extra traffic. Put those phones down in school zones too. #ArlingtonTX",#ArlingtonTX
66,2020-01-07 01:37:51+00:00,ArlingtonPD,Great sunset this evening. Have a great rest of the day folks!,
67,2020-01-06 23:18:02+00:00,ArlingtonPD,"2 suspects fled a recent traffic stop & attempted to hide in a creek. Lucky for them, our Aviation Unit spotted them from above & officers ended up saving their lives as hypothermia was setting in with the frigid water. They were so weak, officers had to carry them out to safety.",
68,2020-01-06 16:06:15+00:00,ArlingtonPD,"Our South Patrol Officers were busy this weekend getting some criminals off of our streets. They made 7 arrests and recovered weapons that were still warm from being fired. We continue to go after known offenders, guns and drugs to keep our community safe.",
69,2020-01-05 23:38:36+00:00,ArlingtonPD,"As the holiday period and weekend leaves us behind, we hope everyone has a great week!",
70,2020-01-05 19:12:12+00:00,ArlingtonPD,"FATALITY CRASH We responded to a single vehicle crash involving a car & light pole this morning in 5500 block of North Little School Road. Driver lost control & drove over the curb & struck the light pole. The driver, a man in his 30’s, was pronounced deceased at the scene.",
71,2020-01-04 21:53:51+00:00,ArlingtonPD,"MISSING PERSON FOUND DECEASED On Jan 3, 2020 at 11:44 p.m., we were notified by a city utility crew that workers had located a possible body in a wooded area in 7100 block of Webb Ferrell. The Medical Examiner has identified the body as Evan Lacey through fingerprint analysis.",
72,2020-01-04 04:48:34+00:00,ArlingtonPD,Homicide Invest. We responded to 600 block of Greystoke Dr. in reference to multiple gunshots. Arriving officers found blood evidence. We later learned 2 persons arrived at AMH with gunshot wounds. One person deceased at hospital & other in surgery. http://817.469.TIPS,
73,2020-01-03 16:44:08+00:00,ArlingtonPD,"New year. New #FureverFriday y'all. Kicking things off in 2020 is Sgt. Jill Willis and Cowboy, a 1 1/2-year-old retriever / shepherd mix. If you'd like to give Cowboy a ""furever"" home, you can visit him at #ArlingtonTX Animal Services, located at 1000 SE Green Oaks Blvd.",#FureverFriday #ArlingtonTX
74,2020-01-02 23:45:57+00:00,ArlingtonPD,"Here is a fresh Most Wanted for 2020. If you have information on any of these wanted fugitives, please call Crime Stoppers of Tarrant County at (817) 469-TIPS (8477). Crime Stoppers pays up to $1,000 for info. leading to an arrest. @469tips #ArlingtonTX #TopTen #MostWanted",#ArlingtonTX #TopTen #MostWanted
75,2020-01-02 20:11:00+00:00,ArlingtonPD,APD and @ArlingtonTxFire are working a manure spill at southbound 360 and westbound I-20 exit ramp. It is causing slick conditions and we hope to have it cleared up and ramp reopened by 4 pm. Take the Mayfield exit to get to I-20 and avoid it. #oops #ArlingtonTX,#oops #ArlingtonTX
76,2020-01-02 17:45:37+00:00,ArlingtonPD,Feeling a little nostalgic with the new year. Can you believe just 20 years ago (At the end of the 20th Century) we were using the Motorola 9000-T Mobile Data Terminals in our patrol cars? WOW! We have come a long way!#ThrowbackThursday #TBT #HappyNewYear2020,#ThrowbackThursday #TBT #HappyNewYear2020
77,2020-01-01 06:42:57+00:00,ArlingtonPD,What can we say? We just HAD to know where @KrisGutierrez got that sweet hat!! Thanks for hanging out in #ArlingtonTX tonight! We hope everyone has a safe and happy new year!! #LoneStarNYELive,#ArlingtonTX #LoneStarNYELive
78,2019-12-31 23:33:50+00:00,ArlingtonPD,Thank you @MansfieldPDTX K9 Oso and Handler Alejandro for your help over the years when you responded to assist our team. Congrats on a good retirement!,
79,2019-12-31 15:51:11+00:00,ArlingtonPD,"We want to wish everyone a safe and happy new year! If your plans tonight involve alcohol, PLEASE plan ahead -- and make arrangements to stay somewhere overnight or find a safe ride home. There is NO EXCUSE to drink and drive! #ArlingtonTX",#ArlingtonTX
80,2019-12-29 19:03:43+00:00,ArlingtonPD,Well #CowboysNation it may not have been exactly the season you wanted so far... but the @dallascowboys are only NFC team still in the hunt for the playoffs! We know they can do it! Let’s Go Cowboys! #WASvsDAL,#CowboysNation #WASvsDAL
81,2019-12-28 23:34:18+00:00,ArlingtonPD,Full rainbow to the east and gorgeous sunset to the west. #dfwwx,#dfwwx
82,2019-12-28 00:53:36+00:00,ArlingtonPD,That’s a good group of officers! Best of luck #CottonBowl #PennState,#CottonBowl #PennState
83,2019-12-27 20:27:33+00:00,ArlingtonPD,"UPDATE: We’ll have a brand new #FureverFriday pup to introduce you to next week, once everyone is back and fully recovered from the holidays. But we wanted to let y’all know that Milton, who we featured two weeks ago, has been adopted! Here she is with her new family!",#FureverFriday
84,2019-12-26 23:25:45+00:00,ArlingtonPD,We have understood the importance of Crime Prevention for a long time. Just look at the photo of this van and you can see it! Make sure to hide those purchases in your car as you head back to the stores this week. Thanks! #ThrowbackThursday #TBT,#ThrowbackThursday #TBT
85,2019-12-26 16:47:18+00:00,ArlingtonPD,"Tomorrow, Friday, Dec. 27 at 10 am a wreath ceremony will be held to recognize the 9th anniversary of our loss of Officer Jillian Michelle Smith. The ceremony will be held at Moore Memorial Gardens, 1219 N Davis St., Arlington, TX. The Public is welcome to attend. #NeverForgotten",#NeverForgotten
86,2019-12-25 14:10:43+00:00,ArlingtonPD,Merry Christmas from all of us here at Arlington PD!,
87,2019-12-25 04:11:08+00:00,ArlingtonPD,#ChristmasEve #SantaSighting,#ChristmasEve #SantaSighting
88,2019-12-25 01:36:04+00:00,ArlingtonPD,It’s Christmas Eve — and we are officially on Santa Watch!! Tune into our special report as we track his movements. Our friends at @GrandPrairiePD and @MansfieldPDTX are helping us keep an eye out for the big guy as well!! #ArlingtonTX,#ArlingtonTX
89,2019-12-24 17:22:31+00:00,ArlingtonPD,Tune in tonight around 7:30 pm for live reports in the field on Santa sightings. We have @MansfieldPDTX and @GrandPrairiePD assisting us in searching the skies! #SantaSighting,#SantaSighting
90,2019-12-23 16:34:09+00:00,ArlingtonPD,APD along with @MansfieldPDTX is seeking the public’s help in identifying this suspect who is possibly linked to 3 commercial burglaries of fine jewelry stores. Contact Tarrant County Crime Stoppers at 817-469-TIPS if you know this guy. https://www.facebook.com/186503035754/posts/10156441132165755/?d=n,
91,2019-12-23 14:58:57+00:00,ArlingtonPD,Tomorrow is the big day.... Christmas Eve! We will be out on patrol with @ArlingtonChief Will Johnson along with @GrandPrairiePD @ChiefScesney and @MansfieldPDTX @MansfieldChief Tracy Aaron for possible sightings of Santa. Stay tuned! #SantaSighting,#SantaSighting
92,2019-12-22 19:05:32+00:00,ArlingtonPD,"Have you seen 19-year old Evan Lacey? He is a missing person from Arlington who was last seen on Tuesday, December 17. His car was located yesterday under suspicious circumstances by @fortworthpd in the 4200 block of S. Hughes Avenue. Anyone with info call 9-1-1",
93,2019-12-21 21:30:24+00:00,ArlingtonPD,We stopped a stolen vehicle from Cedar Hill and detained one suspect at this time near Cooper and High Point. Still searching area for other suspects.,
