,0,1,2,3
732,2018-11-15 22:03:14+00:00,ArlingtonPD,"Its #ThrowbackThursday Anyone remember this?? ""...One Adam 12... One Adam 12... See the man... or woman wanted in this week's @ArlingtonPD top 10 most wanted fugitives..."" Crime Stoppers will pay up to $1,000 for information leading to an arrest.",#ThrowbackThursday
733,2018-11-15 13:56:10+00:00,ArlingtonPD,"Baby strollers are for children, not stuffing items into bags you’re trying to steal. These 2 suspects went into a business in the 3800 block of S. Cooper St., selected specific items, went into a changing room to conceal them and tried to run out. Det. Blanco at 817-459-6647",
734,2018-11-13 23:27:17+00:00,ArlingtonPD,One of our @ArlingtonPD officers was sent to an Assist Motorist call. When she arrived she saw some outstanding citizens who were already helping change the tire. #WKD #WorldKindnessDay,#WKD #WorldKindnessDay
735,2018-11-13 11:16:11+00:00,ArlingtonPD,***UPDATE*** Mr. Janky has been safely located!,
736,2018-11-13 02:08:00+00:00,ArlingtonPD,If anyone sees Mr. Janky or his vehicle please call 9-1-1.,
737,2018-11-13 02:02:03+00:00,ArlingtonPD,"Please help us locate Gary Janky,79. Last seen today in the 5400 blk. of Park Springs Blvd, wearing a blue button down shirt, tan and red jacket, blue jeans and black shoes. Driving a 2015 White Volkswagen Tiguan, license plate FDD9406. He is 6’0, and 230-240 lbs. #silveralert",#silveralert
738,2018-11-12 22:16:30+00:00,ArlingtonPD,Old Man Winter is here! There is a Freeze Warning in effect with lows in the upper 20’s tonight!! REMEMBER TO: *Bring in your PETS *Protect PIPES *Cover or bring in any PLANTS *Make PLANS to clean off car windows and allow extra time to get around in the morning. ,
739,2018-11-12 15:04:15+00:00,ArlingtonPD,"Tonight, we are hosting our Dog Walker Watch program at the South Station from 6-8 p.m. Come bring your pooch by and join this great neighborhood program that trains citizens to actively patrol their communities while out walking their dogs.",
740,2018-11-11 15:26:40+00:00,ArlingtonPD,Thank you VETERANS! We honor all those who have served the #VeteransDay2018,#VeteransDay2018
741,2018-11-11 01:02:04+00:00,ArlingtonPD,The west and eastbound lanes of IH 30 are in the process of being reopened early due to @TxDOT finishing early this weekend.,
742,2018-11-10 23:49:00+00:00,ArlingtonPD,"If you missed the Arlington #Aheroesparade today you missed lots of veterans, cool vehicles and floats. @ArlingtonPD Mounted Unit and Honor Guard marched the mile + downtown. We appreciated the participants and attendees! #AHP2018",#Aheroesparade #AHP2018
743,2018-11-10 22:02:26+00:00,ArlingtonPD,"Great job by our East and North Patrol Districts, Aviation Unit, Gun Crimes Unit, Narcotics Unit and K9 Team. Thank you @TxDPS Air Support Unit for helping as well. Read about 3 arrests that occurred overnight and this morning. https://www.facebook.com/186503035754/posts/10155598546775755/",
744,2018-11-10 18:11:45+00:00,ArlingtonPD,A good crisp morning for a 5k! @ArlingtonPD Motor Unit was escorting the 4th Annual Arlington Heroes Run @ArlingtonParks Veterans Park.,
745,2018-11-09 14:07:29+00:00,ArlingtonPD,"We will not tolerate these threats placed on social media platforms. We will find you and arrest you. Parents, watch this video with your kids and teens: https://youtu.be/_tgyNHdlJZY",
746,2018-11-08 22:54:16+00:00,ArlingtonPD,"Keep some watchful eyes out for these 10 fugitives. Our Top Ten most wanted for the week. Crime Stoppers will pay up to $1,000 for information leading to an arrest.",
747,2018-11-06 17:52:50+00:00,ArlingtonPD,"November 11th is Veterans Day - a special day set aside to pay tribute to the brave men and women of the armed forces. The APD is proud to employ many military members. If you have served, we would like to talk to you about serving the @CityOfArlington . http://www.arlington-tx.gov/police/recruiting/",
748,2018-11-06 14:07:45+00:00,ArlingtonPD,TRAFFIC UPDATE - All lanes of Eastbound I-20 at Green Oaks are back open.,
749,2018-11-06 11:53:28+00:00,ArlingtonPD,"**TRAFFIC ALERT** All eastbound lanes of I-20 at Green Oaks are closed due to crash investigation. Please seek alternate route. Take SB 287 to Cooper St, then go NB on Cooper to I-20. Also NB 287 to 820, go EB on TX-303/Rosedale, SB on Cooper to I-20.",
750,2018-11-06 02:01:39+00:00,ArlingtonPD,Welcome to @CityOfArlington and @ATTstadium ! Mr. @AmariCooper_9 Nice first #CowboysNation touchdown!,#CowboysNation
751,2018-11-05 19:37:47+00:00,ArlingtonPD,Hey #CowboysNation are you ready for some #MNF ? It's @Titans vs. @dallascowboys Be aware as these parking spaces @ATTstadium will be filling up fast! #TENvsDAL @ArlingtonPD will be there to help you get in and out.,#CowboysNation #MNF #TENvsDAL
752,2018-11-05 14:46:34+00:00,ArlingtonPD,"Not cool. Package thieves are already on Santa’s naughty list. This guy took a package off the porch from a home in the 2000 blk of Lennox Lane. If you recognize him, Det. Blanco at 817-459-6647. Make sure to take steps to protect your deliveries this holiday season from crooks!",
753,2018-11-05 02:05:22+00:00,ArlingtonPD,,
754,2018-11-05 02:05:02+00:00,ArlingtonPD,Fatality crash involving motorcycle and SUV this evening at New York Avenue and Highbank Drive.,
755,2018-11-05 02:01:23+00:00,ArlingtonPD,Working a fatality crash. We should be clearing it soon.,
756,2018-11-04 23:52:42+00:00,ArlingtonPD,A beautiful sunset as the weekend winds down. Have a great week!,
757,2018-11-04 02:19:28+00:00,ArlingtonPD,Don’t forget to move the clocks back before going to bed. Have a safe weekend!,
758,2018-11-03 01:36:51+00:00,ArlingtonPD,Thank you Maria and all the POAF Board Members for your unwavering support and commitment! To learn more about this organization go to https://poaf.org,
759,2018-11-02 14:21:07+00:00,ArlingtonPD,TRAFFIC REMINDER: North and Southbound SH 360 will be closing tonight 7 p.m. at Abram Street. Look for those alternate routes and avoid the area if possible. The closure will be from 7 p.m. tonight until Monday morning at 6 a.m.,
760,2018-11-01 19:00:24+00:00,ArlingtonPD,"A very sobering lesson today was delivered by DWI Officer Stacie Brown and our friends with @WatchURBAC . They were out at Venture HS today to let the kids see firsthand using a simulator why drinking and driving, texting and driving and distracted driving is just not worth it.",
761,2018-11-01 17:49:27+00:00,ArlingtonPD,"Help us nab one of these 10 fugitives and Crimes Stoppers could pay up to $1,000. Our Top-10 Most Wanted for the Week. Any information that leads us to an arrest of one of these 10 and Crime Stoppers will pay up to $1,000.",
762,2018-11-01 14:04:49+00:00,ArlingtonPD,Avoid northbound US 287 to westbound IH 20 due to an incident in Fort Worth on Loop 820. Traffic delays are in excess of a half hour with traffic backed up past Sublett.,
763,2018-11-01 13:18:06+00:00,ArlingtonPD,"Please lay all eyes on this video. This group of 5 bandits went into a commercial business in the 1900 block of S. Peyco and stole a significant amount of specialized industrial hardware. They walked away with close to $250,000 when they were done. Det. Bunster at 817-459-6640",
764,2018-11-01 00:51:02+00:00,ArlingtonPD,Super Heroes #Halloween2018,#Halloween2018
765,2018-11-01 00:39:16+00:00,ArlingtonPD,"A lot of superhero’s out tonight...and a few of our officers joined in the fun as well. Still some time to enjoy a great evening now that the rain is gone, watch out for the little ones as roads might still be slick. #Halloween18",#Halloween18
766,2018-11-01 00:07:02+00:00,ArlingtonPD,The rain didn’t stop our Trunk or Treat at the South Patrol Service Center! We are still here till 8 pm! Happy Halloween!,
767,2018-10-31 18:00:22+00:00,ArlingtonPD,"Rain got you worried about trick or treating? Don’t be, we have you covered for #Halloween . Rain OR shine, Trunk or Treat will still be going on at the South Station tonight from 6-8 p.m. Bring the family by for a great evening inside our community room at 1030 SW Green Oaks.",#Halloween
768,2018-10-31 16:04:53+00:00,ArlingtonPD,"There is a very important road closure this weekend at SH 360 and Abram Street. Starting Friday night at 7 pm and lasting through 6 am on Monday, the North and Southbound lanes of SH 360 will be closed approaching Abram Street. Seek alternate routes. http://www.arlington-tx.gov/news/2018/10/31/traffic-alert-sh-360-abram-street-closures-arlington-weekend/",
769,2018-10-31 13:59:34+00:00,ArlingtonPD,"Let's hope all that wet stuff gets out of here by sundown so the trick-or-treaters will have a great night....but until then, watch for the heavy rains and areas that have already been flooded.",
770,2018-10-29 20:44:02+00:00,ArlingtonPD,"Some significant progress is being made on the I-30/SH 360 construction project but be aware of a major road closure set for November 9-12. Traffic will be detoured along Collins Street, Division Street and the PGB Turnpike. Avoid that area at all costs. http://www.arlington-tx.gov/news/2018/10/26/traffic-alert-full-closure-interstate-30-arlington-set-nov-9-12/",
771,2018-10-29 18:56:29+00:00,ArlingtonPD,The work of preventing acts of violence rooted in hatred is a top priority for our profession. Equal protection under the law & preservation of civil rights for all persons is the cornerstone of what law enforcement stands for. Proud of @ArlingtonChief and his work on this topic,
772,2018-10-29 18:43:02+00:00,ArlingtonPD,"In conjunction with the @COPSOffice &amp; @CivilRights, @ArlingtonChief is participating in a police roundtable on the successful practices &amp; challenges in identifying, reporting, &amp; tracking hate crimes as part of the @TheJusticeDept Hate Crimes Enforcement &amp; Prevention Initiative.",
773,2018-10-29 17:18:33+00:00,ArlingtonPD,It was a great morning to help a great cause. We raised a lot of money for the @SOTexas with our Joey Cushman 5K and fun run at River Legacy Park. Thank you to everyone who came out for a great time to help honor Joey and help our friends at the Special Olympics.,
774,2018-10-27 22:04:50+00:00,ArlingtonPD,"Two arrests made in connection with the dog mauling that occurred on September 26, 2018 for the owners of the animals. Both charges were for Texas Health and Safety Code 822.005 Attack by Dog.",
775,2018-10-27 02:39:47+00:00,ArlingtonPD,Have a safe and great night. Make sure you have a safe ride home or designate someone to be your safe driver.,
776,2018-10-26 20:36:22+00:00,ArlingtonPD,Ok. We have actually intercepted a few reckless drivers who have been reported on 911. You can also contact our Road Rage Hotline (817) 459-5389 to report incidents that are not in-progress and we will generate a letter to the registered owner. Have a good day sir.,
777,2018-10-26 18:08:28+00:00,ArlingtonPD,"In progress driving that is dangerous, please call 911 since our traffic officers are strategically placed throughout the city and on the highways. Videos that have identifying info can be forwarded to Jeff.pugh@arlingtontx.gov",
778,2018-10-26 17:30:57+00:00,ArlingtonPD,"If you have video of egregious driving, you should send it to us and we will absolutely pay an in-person visit to the person. We can’t mail citations to a registered owner... we have to be able to identify the actual driver.",
779,2018-10-26 17:15:42+00:00,ArlingtonPD,This was sent in by a passenger. Feel free to report aggressive drivers by calling 9-1-1,
780,2018-10-26 17:10:54+00:00,ArlingtonPD,"As we continue to address egregious driving behaviors that can lead to road rage, this is a great example of what a private citizen sent to us. We identified the driver & issued 3 citations for failure to signal lane change, following too closely & unsafe lane change.",
781,2018-10-26 16:26:30+00:00,ArlingtonPD,Tomorrow is our Drug Take Back event from 10 a.m. – 2 p.m. There will be four different locations throughout the city that you can turn in that unused or expired medication for safe disposal.,
782,2018-10-25 19:45:54+00:00,ArlingtonPD,It was career day out at Corey Elementary this morning and our Mounted Unit had a great time visiting with the kids about policing….and policing from a horse.,
783,2018-10-25 13:42:53+00:00,ArlingtonPD,"These 10 faces are on the run and we want to find them. Our Top-10 Most Wanted for the Week. Crime Stoppers will throw in up to $1,000 for any information that leads us to an arrest.",
784,2018-10-24 16:31:40+00:00,ArlingtonPD,"Time for that pup of yours to join our Dog Walker Watch program. We are holding our next class on Monday, November 12 at the South Station from 6-8 p.m. This program is designed for joggers and walkers that can actively patrol their neighborhoods while out walking their dogs.",
785,2018-10-23 04:17:27+00:00,ArlingtonPD,News Release on Road Rage Shooting.,
786,2018-10-23 03:42:12+00:00,ArlingtonPD,"Working a road rage shooting that occurred at 8:07 pm westbound lanes of IH 20 and New York Ave. Suspect is a Hispanic man in mid 20’s in a light colored, white or silver hatchback. Victim will survive this shooting after being shot in front of family.",
787,2018-10-20 22:48:39+00:00,ArlingtonPD,Great day to finally see the shining! Have a safe and wonderful weekend.,
788,2018-10-19 18:17:52+00:00,ArlingtonPD,We are just 1 week out from the 8th Annual Officer Jillian Smith Charity Gala Casino Night Fundraiser. The fun starts at 8 p.m. at the Mediterranean Villa in Arlington and lasts until midnight. The proceeds go directly to the Jillian Smith SafeLiving Fund. https://www.eventbrite.com/e/8th-annual-officer-jillian-m-smith-charity-benefit-tickets-48464886781?fbclid=IwAR2o08me1YL-cPkkzxxqJlKzHsMP9-OtUp6d_qpaPCkcP0wTUYNUgFb9A5Y,
789,2018-10-18 23:50:09+00:00,ArlingtonPD,TRAFFIC ALERT UPDATE: All lanes EB I-20 at Green Oaks Blvd are now open.,
790,2018-10-18 22:28:18+00:00,ArlingtonPD,TRAFFIC ALERT: Major Accident at EB I-20 at Green Oaks Blvd. Two outside lanes are closed. All EB service lanes are open. Take SB 287 as an alternate route.,
791,2018-10-17 18:15:37+00:00,ArlingtonPD,"Here is a textbook definition of a beer run. This beer baron swiped 5 cases from a convenience store in the 5000 block of Little School Road and took off. He left in a Gray Dodge truck. Det. Thompson if you recognize him, 817-459-6054 or email, leonor.thompson@arlingtontx.gov",
792,2018-10-16 15:09:05+00:00,ArlingtonPD,We are looking for active dog owners who want to make a difference in their community. Our next Dog Walker Watch class will be held on November 12 at the South Station at 1030 SW Green Oaks Blvd from 6-8 p.m.,
793,2018-10-15 16:08:44+00:00,ArlingtonPD,"Take a good long look at these two thieves we are looking for. They stole multiple cable wire lines from a commercial business in the 3400 block of S. Watson Road. They left in a dark extended cab pickup truck. If you have seen these two, Det. Belauskas at 817-459-5811",
794,2018-10-15 13:34:50+00:00,ArlingtonPD,"You know its cold when our friends in @NWSFairbanks will be enjoying the same type of temperatures today...Traffic is slow everywhere because of the wet weather, be a little patient and make sure everyone gets to work and school safely.",
795,2018-10-13 13:50:33+00:00,ArlingtonPD,. @NWSFortWorth National has Arlington and Tarrant County under a flash flood watch and the rain is coming. Be safe and #turnarounddontdrown PRECAUTIONARY/PREPAREDNESS ACTIONS... A Flash Flood Watch means that conditions are favorable for heavy rain which may lead to flash flood,#turnarounddontdrown
796,2018-10-12 18:46:35+00:00,ArlingtonPD,Help @ArlingtonPD honor Joey and raise some money for @SpecialOlympicstx athletes. Sat. Oct. 27th is the 16th Annual Joey Cushman 5k. Register at http://www.sotx.org/events/jc5k/,
797,2018-10-12 15:08:54+00:00,ArlingtonPD,"Dodge those raindrops this weekend, but keep an eye peeled for these 10 faces who are dodging us. Our Top-10 Most Wanted for the Week. Crime Stoppers will pay up to $1,000 for any information that leads us to an arrest of one of these fugitives.",
798,2018-10-11 17:24:34+00:00,ArlingtonPD,Traffic Update: The crash has been cleared and all lanes are back open now.,
799,2018-10-11 15:56:45+00:00,ArlingtonPD,".@ArlingtonPD is working a rolled over 18 wheeler crash @N. Bound Watson and Road to Six Flags.Drivers are unable to go N on 360 from I30, but both highways are open.Please avoid the area. May want to use George Bush as an alternate route. We hope to have it back open by 1 PM.",
800,2018-10-11 15:32:42+00:00,ArlingtonPD,Take a peek at these 2 burglars. They broke into a business in the 3300 block of S. Collins St. and were able to leave with the safe and a significant amount of cash. The suspects left in a Black Ford Expedition. Det. Trinh at 817-459-5805 or email hugh.trinh@arlingtontx.gov.,
801,2018-10-11 14:34:46+00:00,ArlingtonPD,Our “Bridge Kids” program was the winner of the 2018 @TML_Texas Excellence Award for in the Public Safety Category. The Bridge Kids is an initiative the @ArlingtonPD started in 2016 to help kids at a nearby elementary school get home safely crossing over a pedestrian bridge.,
802,2018-10-10 02:43:07+00:00,ArlingtonPD,Thanks Julie! Learned from the best!!,
803,2018-10-10 01:11:25+00:00,ArlingtonPD,"Please join us in congratulating @ArlingtonChief Will D. Johnson for being elected to @TheIACP Vice President at Large! He was sworn in at the #IACP2018 Conference representing over 36,000 members. He is first Arlington Chief in the 125 year history of IACP to hold this position!",#IACP2018
804,2018-10-09 16:25:00+00:00,ArlingtonPD,"It has been 26 years, but we still remember. We honor Terry Lewis and Jerry Crocker. End of Watch: October 9, 1992. #NeverForgotten #HeroesLiveForever",#NeverForgotten #HeroesLiveForever
805,2018-10-09 15:40:15+00:00,ArlingtonPD,Road closure at Davis between Tucker and Mockingbird due to high water. Continuing rain on saturated ground is making driving dangerous. #TurnAroundDontDrown,#TurnAroundDontDrown
806,2018-10-09 15:18:40+00:00,ArlingtonPD,"This is in the 3300 block of W. Division street. Please be careful out on the roads, the rain has not stopped. #TurnAroundDontDrown",#TurnAroundDontDrown
807,2018-10-09 15:00:18+00:00,ArlingtonPD,The rain is continuing to come down rapidly. Since 9 a.m. we have worked over a dozen calls to assist motorists. Please avoid those roads that have high water. #turnarounddontdrown,#turnarounddontdrown
808,2018-10-09 14:36:28+00:00,ArlingtonPD,The rain is really coming down right now all around @CityOfArlington . Watch for any flood prone roadways and avoid those areas. #turnarounddontdrown,#turnarounddontdrown
809,2018-10-09 12:14:42+00:00,ArlingtonPD,"We have seen a lot of heavy rain the last few weeks, so please be sure to stay away from those flood prone areas. Take some extra time getting the kids to school and into the office on the roads this morning.",
810,2018-10-08 15:55:16+00:00,ArlingtonPD,"Put Fri, Oct. 26 on your calendar. The AAPOAA is hosting the 8th Annual Officer Jillian Smith Charity Gala Casino Night Fundraiser. The fun starts at 8 p.m. at the Mediterranean Villa in Arlington. ALL the proceeds go to the Jillian Smith SafeLiving Fund. https://www.eventbrite.com/e/8th-annual-officer-jillian-m-smith-charity-benefit-tickets-48464886781",
811,2018-10-06 20:05:55+00:00,ArlingtonPD,"#IACP2018 @ArlingtonChief Will Johnson participating on a panel with @COPSOffice on attracting, hiring and retaining the best employees for the profession. “Organizational values drive culture and organizational culture drives recruiting.”",#IACP2018
812,2018-10-05 23:26:43+00:00,ArlingtonPD,.@ArlingtonPD knows @Taylorswift13 has a #reputationtour for putting on great concerts at @ATTStadium We will be there to keep everybody safe.,#reputationtour
813,2018-10-05 13:34:54+00:00,ArlingtonPD,"A job well done. After 51 years of dedicated law enforcement with the @ArlingtonPD and other agencies, Officer Roy Mitchell is retiring. We thank you for your service and wish you the best in retirement Officer Mitchell!",
814,2018-10-04 19:01:45+00:00,ArlingtonPD,#WorldAnimalDay saw this guy become our resident “jail bird” He decided to burrow his new home in the corner of our jail. We hope he bonds out soon.,#WorldAnimalDay
815,2018-10-04 16:20:44+00:00,ArlingtonPD,Excellent work by Detective Bryan Cline who spent some time recently at the headquarters of @offerup . He gave some very insightful information and best practices to their employees and showed the importance of community policing.,
816,2018-10-03 15:13:26+00:00,ArlingtonPD,Al's Hamburgers and @Whataburger was the place to be this morning as we celebrated #NationalCoffeeWithACopDay . A lot of smiling faces as we had a chance to down a hot cup of joe with the best community members around.,#NationalCoffeeWithACopDay
817,2018-10-03 13:34:19+00:00,ArlingtonPD," with Cop, a fantastic way to get the day started. We are at Chick-fil-a on Little Rd and S Cooper St til 9. You can meet us from 9-11 in E Arlington at Whataburger 212 S Watson at Abram St or N Arlington at Al’s Hamburgers on N Collins St.",
818,2018-10-03 02:33:18+00:00,ArlingtonPD,Thankful for the outpouring of community support during #NationalNightOut,#NationalNightOut
819,2018-10-03 00:51:39+00:00,ArlingtonPD,#NationalNightOut in @CityOfArlington with hundreds of public safety in and around the 200+ parties meeting neighbors and greeting kiddos.,#NationalNightOut
820,2018-10-02 23:57:00+00:00,ArlingtonPD,Thank you @BGCA_Clubs for participating in #NationalNightOut this evening. @ArlingtonChief Johnson on hand greeting kids and building relationships.,#NationalNightOut
821,2018-10-02 23:54:33+00:00,ArlingtonPD,#NationalNightOut in full swing in Arlington. Over 211 parties occurring throughout the city.,#NationalNightOut
822,2018-10-02 15:37:08+00:00,ArlingtonPD,"We are looking to find these 2 suspects who into a business in the 5400 block of S. Cooper St. and stole numerous items. The suspects went into a dressing room, removed the tags from the items and then concealed them before heading for the exit. Det. Langlois at 817-575-8598",
823,2018-10-01 14:58:19+00:00,ArlingtonPD,"National Night Out is tomorrow, but it’s not too late to register your party with us! A great night of fun, fellowship and food for your neighborhood. https://www.arlingtonpd.org/WebApps/CommunityWatch/NNORegistrationForm.aspx",
824,2018-09-29 15:05:00+00:00,ArlingtonPD,"Academy Class 54 went through 32 weeks of highs and lows, but they persevered and are now ready to serve the community. We take a quick look back at the times for Class 54 at the academy.",
825,2018-09-28 21:39:32+00:00,ArlingtonPD,Graduation was a success.. After months in class it’s time to celebrate the accomplishments of @ArlingtonPD Class 54!,
826,2018-09-28 13:20:29+00:00,ArlingtonPD,"Keep some watchful eyes out for these 10 fugitives. Our Top-10 Most Wanted for the Week. Crime Stoppers will pay up to $1,000 for information leading to an arrest.",
827,2018-09-28 12:26:40+00:00,ArlingtonPD,"The big night is almost here, National Night Out is this upcoming Tuesday, October 2. Time is running out to register your party, so don’t delay and get your party registered today! https://www.arlingtonpd.org/WebApps/CommunityWatch/NNORegistrationForm.aspx",
828,2018-09-26 19:40:09+00:00,ArlingtonPD,In one week you can have a nice relaxing morning with us as we celebrate National Coffee with a Cop Day on Oct. 3. We will be at the @ChickfilA at 4700 S. Cooper and 4412 Little Road from 7-9 a.m. @Whataburger on 211 S. Watson Rd from 9-11 a.m. and Al's Hamburgers from 9-11 a.m.,
829,2018-09-26 16:16:32+00:00,ArlingtonPD,"We need your help in locating this suspect who scampered out of a store in the 3800 block of S. Cooper Street. Some of the stolen merchandise was recovered, but the suspect fled the location in red Acura. Det. Blanco at 817-459-6647 or email her daisey.blanco@arlingtontx.gov",
830,2018-09-26 12:30:17+00:00,ArlingtonPD,Please give yourself plenty of extra time to get to work and the kids to school safely this morning. There is still a lot of heavy rain in the area. We are working 11 calls since 7 a.m. to assist motorists and traffic because of the rain.,
831,2018-09-25 15:26:06+00:00,ArlingtonPD,We are just one week away from National Night Out! Don’t delay and get your party registered now. It’s easy to register and setup a night of fun for your community. Click this link below and register now. https://www.arlingtonpd.org/WebApps/CommunityWatch/NNORegistrationForm.aspx,
832,2018-09-24 23:21:28+00:00,ArlingtonPD,What a great day for promotions! Congratulations to the newest leaders of @ArlingtonPD. #PromotionalCeremony,#PromotionalCeremony
833,2018-09-24 13:44:11+00:00,ArlingtonPD,Class 54 raise your right hand...,
834,2018-09-22 02:30:50+00:00,ArlingtonPD,Couple pics helping our neighbors in @fortworthpd so that as many of their officers as possible could honor Officer Garrett Hull at the service today. It was our pleasure to answer calls in Fort Worth!,
835,2018-09-21 18:17:50+00:00,ArlingtonPD,It was career day out at Lynn Hale Elementary. We had a great time giving some insight about policing to the kids and showing them what the @ArlingtonPD is all about.,
836,2018-09-21 14:44:33+00:00,ArlingtonPD,"One of the best nights of the year is almost upon us. National Night Out is October 2, and if you’re looking to host a party in your neighborhood there is still time to register. Check out this link start planning for a great evening. http://www.arlington-tx.gov/police/crime-prevention-initiatives/national-night-out/",
837,2018-09-21 12:16:56+00:00,ArlingtonPD,Be watchful for some heavy rains over the next 48 hours. Keep it safe and slow on the roads and watch out for those flood prone areas. #turnarounddontdrown,#turnarounddontdrown
